number	title
3015	Bi-Stride Multi-Scale Graph Neural Network for Mesh-Based Physical Simulation
3016	The Curse of Low Task Diversity: On the Failure of Transfer Learning to Outperform MAML and their Empirical Equivalence
3017	StructViT: Learning Correlation Structures for Vision Transformers
3018	Enhancing Cross-Category Learning in Recommendation Systems with Multi-Layer Embedding Training
3019	A sampling framework for value-based reinforcement learning
3020	TAN without a burn: Scaling laws of DP-SGD
3022	Memory-efficient Trajectory Matching for Scalable Dataset Distillation
3023	Isometric Representations in Neural Networks Improve Robustness
3024	Generalization and Estimation Error Bounds for Model-based Neural Networks
3025	The Dark Side of AutoML: Towards Architectural Backdoor Search
3026	STOCHASTIC NO-REGRET LEARNING FOR GENERAL GAMES WITH VARIANCE REDUCTION
3027	Is Attention All That NeRF Needs?
3028	Abstracting Imperfect Information Away from Two-Player Zero-Sum Games
3029	Red PANDA: Disambiguating Anomaly Detection by Removing Nuisance Factors
3030	Model Transferability with Responsive Decision Subjects 
3031	Representation Learning via Consistent Assignment of Views over Random Partitions
3032	Calibrating Transformers via Sparse Gaussian Processes
3033	 Learning from Others: Similarity-based Regularization for Mitigating Artifacts
3034	Identifiability of Label Noise Transition Matrix 
3035	The power of choices in decision tree learning
3038	Perfectly Secure Steganography Using Minimum Entropy Coupling
3039	Federated Learning with Openset Noisy Labels
3040	Generative Adversarial Training for Neural Combinatorial Optimization Models
3041	Risk Control for Online Learning Models
3042	Scaling Laws for a Multi-Agent Reinforcement Learning Model
3043	Pitfalls of Gaussians as a noise distribution in NCE
3044	Safer Reinforcement Learning with Counterexample-guided Offline Training
3045	Learning to Act through Activation Function Optimization in Random Networks
3046	DiP-GNN: Discriminative Pre-Training of Graph Neural Networks
3047	Basis for Intentions: Efficient Inverse Reinforcement Learning using Past Experience
3048	Dynamics-aware Skill Generation from Behaviourally Diverse Demonstrations
3050	A Unified Approach to Reinforcement Learning, Quantal Response Equilibria, and Two-Player Zero-Sum Games
3051	Integrating Episodic and Global Novelty Bonuses for Efficient Exploration
3053	Enforcing Hard Constraints with Soft Barriers: Safe Reinforcement Learning in Unknown Stochastic Environments
3054	Towards Representative Subset Selection for Self-Supervised Speech Recognition
3055	Leveraging Incompatibility to Defend Against Backdoor Poisoning
3056	Temporal Domain Generalization with Drift-Aware Dynamic Neural Networks
3057	StarGraph: Knowledge Representation Learning based on Incomplete Two-hop Subgraph
3059	Private Data Stream Analysis for Universal Symmetric Norm Estimation
3060	AUTOJOIN: EFFICIENT ADVERSARIAL TRAINING FOR ROBUST MANEUVERING VIA DENOISING AUTOEN- CODER AND JOINT LEARNING
3061	Approximate Conditional Coverage via Neural Model Approximations
3062	Taming the Long Tail of Deep Probabilistic Forecasting
3063	Wide Graph Neural Network
3064	Human-level Atari 200x faster
3065	Scaling Convex Neural Networks with Burer-Monteiro Factorization
3066	Differentially Private $L_2$-Heavy Hitters in the Sliding Window Model
3067	Learning Intuitive Policies Using Action Features
3068	Efficient Edge Inference by Selective Query
3069	Q-Ensemble for Offline RL: Don't Scale the Ensemble, Scale the Batch Size
3070	Noise Injection Node Regularization for Robust Learning
3071	Pretraining the Vision Transformer using self-supervised methods for vision based Deep Reinforcement Learning
3073	Semantic Image Manipulation with Background-guided Internal Learning
3074	Reconciling Security and Communication Efficiency in Federated Learning
3075	Diffusion Adversarial Representation Learning for Self-supervised Vessel Segmentation
3076	Defending against Reconstruction attacks using Rényi Differential Privacy
3077	Prefix Conditioning Unifies Language and Label Supervision
3079	ModReduce: A Multi-Knowledge Distillation Framework with Online Learning
3080	Discovering Latent Knowledge in Language Models Without Supervision
3081	VIMA: General Robot Manipulation with Multimodal Prompts
3082	Structural Adversarial Objectives for Self-Supervised Representation Learning
3084	Spatiotemporal-Memory-Guided Machine Perception for Augmented Reality
3085	Layer Grafted Pre-training: Bridging Contrastive Learning And Masked Image Modeling For Better Representations
3086	Out-of-Distribution Detection and Selective Generation for Conditional Language Models
3087	Recurrent Real-valued Neural Autoregressive Density Estimator for Online Density Estimation and Classification of Streaming Data
3088	LSTM-BASED-AUTO-BI-LSTM for Remaining Useful Life (RUL) Prediction: the first round of test results
3089	Graph in Graph Neural Network
3091	Unpacking Large Language Models with Conceptual Consistency
3092	Communication-Optimal Distributed Graph Clustering under Duplication Models
3093	Interpretable Debiasing of Vectorized Language Representations with Iterative Orthogonalization
3094	How to Train your HIPPO: State Space Models with Generalized Orthogonal Basis Projections
3095	SaMoE: Parameter Efficient MoE Language Models via Self-Adaptive Expert Combination
3096	SemSup-XC: Semantic Supervision for Extreme Classification
3098	Waveformer: Linear-Time Attention with Forward and Backward Wavelet Transform
3099	Continuous-time identification of dynamic state-space models by deep subspace encoding
3100	MERMADE: $K$-shot Robust Adaptive Mechanism Design via Model-Based Meta-Learning
3101	Text Summarization with Oracle Expectation
3102	MaskViT: Masked Visual Pre-Training for Video Prediction
3104	On the Activation Function Dependence of the Spectral Bias of Neural Networks
3106	Graduated Non-Convexity for Robust Self-Trained Language Understanding
3108	Leveraging Human Features at Test-Time
3109	Measuring Forgetting of Memorized Training Examples
3110	PointConvFormer: Revenge of the Point-Based Convolution
3111	Learning to Segment from Noisy Annotations: A Spatial Correction Approach
3112	ContraSim -- A Similarity Measure Based on Contrastive Learning
3113	Federated Self-supervised Learning for Heterogeneous Clients
3114	Powderworld: A Platform for Understanding Generalization via Rich Task Distributions
3116	Quantifying Memorization Across Neural Language Models
3117	uGLAD: A deep learning model to recover conditional independence graphs
3118	TT-Rules: Extracting & Optimizing Exact Rules of a CNN-Based Model - Application to Fairness
3119	Counterfactual Memorization in Neural Language Models
3120	A Non-monotonic Self-terminating Language Model
3121	Dr.Spider: A Diagnostic Evaluation Benchmark towards Text-to-SQL Robustness
3122	A critical look at evaluation of GNNs under heterophily: Are we really making progress?
3123	Unmasking the Lottery Ticket Hypothesis: What's Encoded in a Winning Ticket's Mask?
3124	Characterizing the spectrum of the NTK via a power series expansion
3125	Bridging the Gap between Semi-supervised and Supervised Continual Learning via Data Programming
3126	Peaks2Image: Reconstructing fMRI Statistical Maps from Peaks
3127	Temporal Dependencies in Feature Importance for Time Series Prediction
3128	Deep Dependency Networks for Action Classification in Video
3129	Meta-learning from demonstrations improves compositional generalization
3130	AutoTransfer: AutoML with Knowledge Transfer - An Application to Graph Neural Networks
3131	Efficient Discrete Multi Marginal Optimal Transport Regularization
3132	AUGMENTING ZERO-SHOT DENSE RETRIEVERS WITH PLUG-IN MIXTURE-OF-MEMORIES
3133	Neural Graphical Models
3134	Rule-based policy regularization for reinforcement learning-based building control
3135	Multi-Segmental Informational Coding for Self-Supervised Representation Learning
3136	TRIDE: A Temporal, Robust, and Informative Data Augmentation Framework for Disease Progression Modeling
3137	Towards Causal Concepts for Explaining Language Models
3138	Unsupervised learning of features and object boundaries from local prediction
3140	Invertible normalizing flow neural networks by JKO scheme
3141	Have Missing Data? Make It Miss More! Imputing Tabular Data with Masked Autoencoding
3142	An alternative approach to train neural networks using monotone variational inequality
3144	Conceptual SCAN: Learning With and About Rules
3145	Neural Design for Genetic Perturbation Experiments
3146	Anamnesic Neural Differential Equations with Orthogonal Polynomial Projections
3147	Tier Balancing: Towards Dynamic Fairness over Underlying Causal Factors
3148	Explaining  Image Classification through Knowledge-aware Neuron Interpretation
3149	Sample-Efficient Reinforcement Learning by Breaking the Replay Ratio Barrier
3150	A Reinforcement Learning Approach to Estimating Long-term Treatment Effects
3151	SMART: Sentences as Basic Units for Text Evaluation
3152	Evaluating Counterfactual Explainers
3153	Countering the Attack-Defense Complexity Gap for Robust Classifiers
3155	Exploring and Exploiting Decision Boundary Dynamics for Adversarial Robustness
3156	Malign Overfitting: Interpolation and Invariance are Fundamentally at Odds
3157	Deep Invertible Approximation of Topologically Rich Maps between Manifolds
3158	On the Geometry of Reinforcement Learning in Continuous State and Action Spaces
3159	Polarity is all you need to learn and transfer faster
3160	Does Decentralized Learning with Non-IID Unlabeled Data Benefit from Self Supervision?
3161	MEDFAIR: BENCHMARKING FAIRNESS FOR MEDICAL IMAGEING
3162	A Deep Reinforcement Learning Approach for Finding Non-Exploitable Strategies in Two-Player Atari Games
3163	Learning with Stochastic Orders
3164	Offline Congestion Games: How Feedback Type Affects Data Coverage Requirement
3165	Graph Attention Retrospective
3166	Is Adversarial Training Really a Silver Bullet for Mitigating Data Poisoning?
3169	Code Means More Than Plain Language: Bringing Syntax Structure Awareness To Algorithmic Problem Solution Generation
3170	Learning Object-Centric Dynamic Modes from Video and Emerging Properties
3171	Cortically motivated recurrence enables task extrapolation
3172	Efficient Sequence Packing without Cross-contamination: Accelerating Large Language Models without Impacting Performance
3173	Representing Latent Dimensions Using Compressed Number Lines
3174	Break the Wall Between Homophily and Heterophily for Graph Representation Learning
3175	Stable Optimization of Gaussian Likelihoods
3176	Self-supervised Continual Learning based on Batch-mode Novelty Detection
3177	Neural Constraint Inference: Inferring Energy Constraints in Interacting Systems
3178	Epistemological Bias As a Means for the Automated Detection of Injustices in News Media
3179	Characterizing neural representation of cognitively-inspired deep RL agents during an evidence accumulation task
3180	LT-SNN: Self-Adaptive Spiking Neural Network for Event-based Classification and Object Detection
3181	Neural Implicit Manifold Learning for Topology-Aware Generative Modelling
3182	BYPASSING THE STABILITY-PLASTICITY TRADEOFF TO REDUCE PREDICTIVE CHURN
3183	Adversarial Representation Learning for Canonical Correlation Analysis
3184	Noise$^+$2Noise: Co-taught De-noising Autoencoders for Time-Series Data
3185	Show and Write: Entity-aware Article Generation with Image Information
3186	Capsa: A Unified Framework for Quantifying Risk in Deep Neural Networks
3187	FedFA:  Federated Feature Augmentation
3188	SlenderGNN: Accurate, Robust, and Interpretable GNN, and the Reasons for its Success
3189	Learning Hyper Label Model for Programmatic Weak Supervision
3190	Tabular Data to Image Generation: Benchmark Data, Approaches, and Evaluation
3191	A Probabilistic Approach to Self-Supervised Learning using Cyclical Stochastic Gradient MCMC 
3192	CURE: A Pre-training Framework on Large-scale Patient Data for Treatment Effect Estimation
3193	Parametrizing Product Shape Manifolds by Composite Networks
3194	Agnostic Learning of General ReLU Activation Using Gradient Descent
3195	Critical Initialization of Wide and Deep Neural Networks through Partial Jacobians: General Theory and Applications
3197	The Surprising Computational Power of Nondeterministic Stack RNNs
3198	Amos: An Adam-style Optimizer with Adaptive Weight Decay towards Model-Oriented Scale
3199	Causal Imitation Learning via Inverse Reinforcement Learning
3200	Achieving Sub-linear Regret in Infinite Horizon Average Reward Constrained MDP with Linear Function Approximation
3201	PaLI: A Jointly-Scaled Multilingual Language-Image Model
3202	BigVGAN: A Universal Neural Vocoder with Large-Scale Training
3204	Where to Begin? Exploring the Impact of Pre-Training and Initialization in Federated
3205	Learning Multimodal Data Augmentation in Feature Space
3206	Global Counterfactual Explanations Are Reliable Or Efficient, But Not Both
3207	Tuning Frequency Bias in Neural Network Training with Nonuniform Data
3208	HEAV: Hierarchical Ensembling of Augmented Views for Image Captioning
3209	Dynamic Pretraining of Vision-Language Models
3210	Discretization Invariant Learning on Neural Fields
3212	Building compact representations for image-language learning
3213	Variational Latent Branching Model for Off-Policy Evaluation
3214	Open-Vocabulary Semantic Segmentation with Mask-adapted CLIP
3215	PerFedMask: Personalized Federated Learning with Optimized Masking Vectors
3216	Variance Double-Down: The Small Batch Size Anomaly in Multistep Deep Reinforcement Learning
3217	RainProof: An Umbrella to Shield Text Generator from Out-Of-Distribution Data
3218	Minimum Description Length Control
3219	Adaptive Parametric Prototype Learning for Cross-Domain Few-Shot Classification
3220	Co-Evolution As More Than a Scalable Alternative for Multi-Agent Reinforcement Learning
3221	A Simple Unsupervised Data Depth-based Method to Detect Adversarial Images
3222	FOCUS: Fairness via Agent-Awareness for Federated Learning on Heterogeneous Data
3223	MetaGL: Evaluation-Free Selection of Graph Learning Models via Meta-Learning
3224	Posthoc Privacy guarantees for neural network queries
3225	On Convergence of Federated Averaging Langevin Dynamics
3226	SPIDR: SDF-based Neural Point Fields for Illumination and Deformation
3227	Uncertainty-Driven Exploration for Generalization in Reinforcement Learning
3228	Koopman Neural Operator Forecaster for Time-series with Temporal Distributional Shifts
3229	Restricted Strong Convexity of Deep Learning Models with Smooth Activations
3230	Revisiting the Assumption of Latent Separability for Backdoor Defenses
3233	Neural DAEs: Constrained neural networks
3235	Contrastive Graph Representation Learning with Cross-view Reconstruction
3236	Learned Neural Network Representations are Spread Diffusely with Redundancy
3237	Open-Vocabulary Object Detection upon Frozen Vision and Language Models
3238	Value-Based Membership Inference Attack on Actor-Critic Reinforcement Learning
3241	Gated Neural ODEs: Trainability, Expressivity and Interpretability
3242	Learning Controllable Adaptive Simulation for Multi-scale Physics
3244	Hyperbolic Deep Reinforcement Learning
3245	TILP: Differentiable Learning of Temporal Logical Rules on Knowledge Graphs
3247	Conditional Permutation Invariant Flows
3248	Toward Discovering Options that Achieve Faster Planning
3250	Self-Stabilization: The Implicit Bias of Gradient Descent at the Edge of Stability
3251	Few-Shot Text Classification with Dual Contrastive Consistency Training
3252	Does Zero-Shot Reinforcement Learning Exist?
3253	Sampling with Mollified Interaction Energy Descent
3254	An Extensible Multi-modal Multi-task Object Dataset with Materials
3255	OTCOP: Learning optimal transport maps via constraint optimizations
3256	Mixed Federated Learning: Joint Decentralized and Centralized Learning
3257	CoMoE: Contrastive Mixture-of-Experts are Efficient Representation Learners
3258	Neural Networks Efficiently Learn Low-Dimensional Representations with SGD
3259	Constraining Representations Yields Models That Know What They Don't Know
3262	FedCUAU: Clustered Federated Learning using weight divergence
3263	Concept Gradient: Concept-based Interpretation Without Linear Assumption
3264	Parameter-Efficient Fine-Tuning Design Spaces
3265	Is a Caption Worth a Thousand Images? A Study on Representation Learning
3266	When Source-Free Domain Adaptation Meets Learning with Noisy Labels
3267	Emb-GAM: an Interpretable and Efficient Predictor using Pre-trained Language Models
3268	Undersampling is a Minimax Optimal Robustness Intervention in Nonparametric Classification
3269	Post-hoc Concept Bottleneck Models
3270	Lipschitz regularized gradient flows and latent generative particles
3272	Explaining Patterns in Data  with  Language Models via Interpretable Autoprompting
3273	SimPer: Simple Self-Supervised Learning of Periodic Targets
3275	Effects of Graph Convolutions in Multi-layer Networks
3276	Active Sampling for Node Attribute Completion on Graphs
3277	A CMDP-within-online framework for Meta-Safe Reinforcement Learning
3278	Deep Biological Pathway Informed Pathology-Genomic Multimodal Survival Prediction
3279	A Sample Based Method for Understanding The Decisions of Neural Networks Semantically
3280	MetaMD: Principled Optimiser Meta-Learning for Deep Learning
3283	Guiding Safe Exploration with Weakest Preconditions
3284	Moving Forward by Moving Backward: Embedding Action Impact over Action Semantics
3285	Domain Generalization via Heckman-type Selection Models 
3286	A Deep Learning Framework for Musical Acoustics Simulations
3287	Large Learning Rate Matters for Non-Convex Optimization
3288	Actionable Recourse Guided by User Preference
3289	Bias Amplification Improves Worst-Group Accuracy without Group Information
3290	Partially Observable RL with B-Stability: Unified Structural Condition and Sharp Sample-Efficient Algorithms
3291	DOT: Fast Cell Type Deconvolution by Optimal Transport
3294	Weighted Ensemble Self-Supervised Learning
3295	Neural Network Approximation of Lipschitz Functions in High Dimensions with Applications to Inverse Problems
3296	Towards Large Scale Transfer Learning for Differentially Private Image Classification
3297	Learning Efficient Hybrid Particle-continuum Representations of Non-equilibrium N-body Systems
3299	Exp-$\alpha$: Beyond Proportional Aggregation in Federated Learning
3300	simpleKT: A Simple But Tough-to-Beat Baseline for Knowledge Tracing
3301	Why Self Attention is Natural for Sequence-to-Sequence Problems? A Perspective from Symmetries
3302	Partial Label Unsupervised Domain Adaptation with Class-Prototype Alignment
3303	The Graph Learning Attention Mechanism: Learnable Sparsification Without Heuristics
3304	Mutual Partial Label Learning with Competitive Label Noise
3305	A Quasistatic Derivation of Optimization Algorithms' Exploration on Minima Manifolds
3306	Examining the Difference Among Transformers and CNNs with Explanation Methods
3309	REV: Information-Theoretic Evaluation of Free-Text Rationales
3310	Assessing Neural Network Robustness via Adversarial Pivotal Tuning of Real Images
3312	Faster federated optimization under second-order similarity
3313	CAN MACHINE TELL THE DISTORTION DIFFERENCE? A REVERSE ENGINEERING STUDY OF ADVERSARIAL ATTACKS
3314	Score-based Generative 3D Mesh Modeling
3316	Learning from Labeled Images and Unlabeled Videos for Video Segmentation
3317	Eigenvalue Initialisation and Regularisation for Koopman Autoencoders
3318	DCI-ES: An Extended Disentanglement Framework with Connections to Identifiability
3319	Learning Listwise Domain-Invariant Representations for Ranking
3320	Simplified State Space Layers for Sequence Modeling
3321	Weakly Supervised Explainable Phrasal Reasoning with Neural Fuzzy Logic
3322	Graph Convolutional Normalizing Flows for Semi-Supervised Classification and Clustering
3323	Towards Solving Industrial Sequential Decision-making Tasks under Near-predictable Dynamics via Reinforcement Learning: an Implicit Corrective Value Estimation Approach
3325	Scalable and Equivariant Spherical CNNs by Discrete-Continuous (DISCO) Convolutions
3326	Diffusion Models for Causal Discovery via Topological Ordering
3327	Revisiting Instance-Reweighted Adversarial Training
3328	Logical view on fairness of a binary classification task
3329	Faster Optimization on Sparse Graphs via Neural Reparametrization
3330	Deconstructing Distributions: A Pointwise Framework of Learning
3331	Graph Neural Network-Inspired Kernels for Gaussian Processes in Semi-Supervised Learning
3332	EmbedDistill: A geometric knowledge distillation for information retrieval
3333	Meta Temporal Point Processes
3334	Efficiently Computing Nash Equilibria in Adversarial Team Markov Games
3335	Learning-Based Radiomic Prediction of Type 2 Diabetes Mellitus Using Image-Derived Phenotypes
3336	TrajGRU-Attention-ODE: Novel Spatiotemporal Predictive Models
3338	Neural DAG Scheduling via One-Shot Priority Sampling
3339	Direct Embedding of Temporal Network Edges via Time-Decayed Line Graphs
3340	LVQ-VAE:End-to-end Hyperprior-based Variational Image Compression with Lattice Vector Quantization
3342	Learning Sparse Group Models Through Boolean Relaxation
3344	Deep Direct Discriminative Decoders for High-dimensional Time-series Data Analysis
3345	Planning Goals for Exploration
3346	Live in the Moment: Learning Dynamics Model Adapted to Evolving Policy
3347	Exploring semantic information in disease: Simple Data Augmentation Techniques for Chinese Disease Normalization
3348	Provably Auditing Ordinary Least Squares in Low Dimensions
3350	Model ChangeLists: Characterizing Changes in ML Prediction APIs
3351	A Scalable and Exact Gaussian Process Sampler via Kernel Packets
3352	Collecting The Puzzle Pieces: Disentangled Self-Driven Human Pose Transfer by Permuting Textures
3353	TuneUp: A Training Strategy for Improving Generalization of Graph Neural Networks
3354	A New Path: Scaling Vision-and-Language Navigation with Synthetic Instructions and Imitation Learning
3355	Skill-Based Reinforcement Learning with Intrinsic Reward Matching
3356	Exact Representation of Sparse Networks with Symmetric Nonnegative Embeddings
3357	Vector Quantized Wasserstein Auto-Encoder
3358	Distributional Signals for Node Classification in Graph Neural Networks
3359	Quantum 3D graph structure learning with applications to molecule computing
3360	Multi-Epoch Matrix Factorization Mechanisms for Private Machine Learning
3361	Copula Conformal Prediction for Multi-step Time Series Forecasting
3362	K-SAM: Sharpness-Aware Minimization at the Speed of SGD
3363	Learning Unsupervised Forward Models from Object Keypoints
3364	Contrastive Learning Can Find An Optimal Basis For Approximately View-Invariant Functions
3366	Transfer Learning with Context-aware Feature Compensation
3367	AlphaDesign: A graph protein design method and benchmark on AlphaFold DB
3368	A Theoretical Understanding of Vision Transformers: Learning, Generalization, and Sample Complexity
3370	PiFold: Toward effective and efficient protein inverse folding
3372	MobileViTv3: Mobile-Friendly Vision Transformer with Simple and Effective Fusion of Local, Global and Input Features
3373	SGD and Weight Decay Provably Induce a Low-Rank Bias in Neural Networks
3375	Prometheus: Endowing Low Sample and Communication Complexities to Constrained Decentralized Stochastic Bilevel Learning
3376	On the Implicit Bias Towards Depth Minimization in Deep Neural Networks
3378	Generating Features with Increased Crop-Related Diversity for Few-shot Object Detection
3379	On $\mathcal{O}(1/K)$ Convergence and Low Sample Complexity for Single-Timescale Policy Evaluation with Nonlinear Function Approximation
3380	Shortcut Learning Through the Lens of Early Training Dynamics
3381	MET : Masked Encoding for Tabular data
3382	Goal-Space Planning with Subgoal Models
3383	Implicit regularization via Spectral Neural Networks and non-linear matrix sensing
3384	On the Mysterious Optimization Geometry of Deep Neural Networks
3385	Deep Bayesian Active Learning for Accelerating Stochastic Simulation
3386	Progress measures for grokking via mechanistic interpretability
3387	Thrust: Adaptively Propels Large Language Models with External Knowledge
3388	Distributed Differential Privacy in Multi-Armed Bandits
3389	Link Prediction with Non-Contrastive Learning
3390	Fast Adaptation via Human Diagnosis of Task Distribution Shift
3391	Towards Adversarially Robust Deepfake Detection: An Ensemble Approach
3392	Provably Efficient Lifelong Reinforcement Learning with Linear Representation
3393	Magnum: Tackling High-Dimensional Structures with Self-Organization
3394	BiViT: Exploring Binary Vision Transformers
3396	Re-Imagen: Retrieval-Augmented Text-to-Image Generator
3397	Improved Sample Complexity for Reward-free Reinforcement Learning under Low-rank MDPs
3399	What Deep Representations Should We Learn? -- A Neural Collapse Perspective
3400	Trusted Aggregation (TAG): Model Filtering Backdoor Defense In Federated Learning
3403	Sequential Attention for Feature Selection
3405	Overthinking the Truth: Understanding how Language Models process False Demonstrations
3406	Structural Code Representation Learning for Auto-Vectorization
3407	Oracles and Followers: Stackelberg Equilibria in Deep Multi-Agent Reinforcement Learning
3408	Seq2Seq Pre-training with Dual-channel Recombination for Translation
3409	Disentangling the Mechanisms Behind Implicit Regularization in SGD
3410	Attention-Guided Backdoor Attacks against Transformers
3411	Node Importance Specific Meta Learning in Graph Neural Networks
3412	Certifiably Robust Policy Learning against Adversarial Multi-Agent Communication
3413	Unleashing the Potential of Data Sharing in Ensemble Deep Reinforcement Learning
3414	SoftMatch: Addressing the Quantity-Quality Tradeoff in Semi-supervised Learning
