number	title
2	Hedge Your Actions: Flexible Reinforcement Learning for Complex Action Spaces
3	Efficient Exploration via Fragmentation and Recall
5	Efficient Multi-Task Reinforcement Learning via Selective Behavior Sharing
6	Model-agnostic Measure of Generalization Difficulty
8	ELODI: Ensemble Logit Difference Inhibition for Positive-Congruent Training
9	Continuous-Discrete Convolution for (3+1)D Geometry-Sequence Modeling in Proteins
10	Winograd Structured Pruning for Fast Winograd Convolution 
11	Patch-Level Contrasting without Patch Correspondence for Accurate and Dense Contrastive Representation Learning
12	Contextual Image Masking Modeling via Synergized Contrasting without View Augmentation for Faster and Better Visual Pretraining
17	BiBench: Benchmarking and Analyzing Network Binarization
18	Understanding the Training Dynamics in Federated Deep Learning via Aggregation Weight Optimization
20	scFormer: a universal representation learning approach for single-cell data using transformers
23	Observation-Centric SORT: Rethinking SORT for Robust Multi-Object Tracking
24	Object Tracking by Hierarchical Part-Whole Attention
25	In the ZONE: Measuring difficulty and progression in curriculum generation
29	Metro: Memory-Enhanced Transformer for Retrosynthetic Planning via Reaction Tree
30	A MULTI-SCALE STRUCTURE-PRESERVING HETEROLOGOUS IMAGE TRANSFORMATION ALGORITHM BASED ON CONDITIONAL ADVERSARIAL NETWORK LEARNING
31	Generalized Category Discovery via Adaptive GMMs without Knowing the Class Number
33	DAG Matters! GFlowNets Enhanced Explainer for Graph Neural Networks
35	Do Spiking Neural Networks Learn Similar Representation with Artificial Neural Networks? A Pilot Study on SNN Representation
41	Masked Surfel Prediction for Self-Supervised Point Cloud Learning
42	Delving into Semantic Scale Imbalance
43	Backpropagation Path Search On Adversarial Transferability
45	Protein structure generation via folding diffusion
52	Rethinking Knowledge Distillation via Cross-Entropy
53	Trust-consistent Visual Semantic Embedding for Image-Text Matching
54	The Augmented Image Prior: Distilling 1000 Classes by Extrapolating from a Single Image
55	SIMPLE: Specialized Model-Sample Matching for Domain Generalization
58	Cooperate or Compete: A New Perspective on Training of Generative Networks
61	Molecular Geometry Pretraining with SE(3)-Invariant Denoising Distance Matching
62	GraphCG: Unsupervised Discovery of Steerable Factors in Graphs
70	DualAfford: Learning Collaborative Visual Affordance for Dual-gripper Manipulation
77	Example-based Planning via Dual Gradient Fields
78	Exploring Visual Interpretability for Contrastive Language-Image Pretraining
79	On amortizing convex conjugates for optimal transport
80	Meta Optimal Transport
82	Neural Attention Memory
83	Mimic before Reconstruct: Enhance Masked Autoencoders with Feature Mimicking
84	MaSS: Multi-attribute Selective Suppression
86	Diversify and Disambiguate: Out-of-Distribution Robustness via Disagreement
88	Surgical Fine-Tuning Improves Adaptation to Distribution Shifts
89	Multi-Domain Long-Tailed Learning by Augmenting Disentangled Representations
90	Representation Learning for Low-rank General-sum Markov Games
91	Multi-Modal Few-Shot Temporal Action Detection
92	Quasi-Conservative Score-based Generative Models
93	TEAS: Exploiting Spiking Activity for Temporal-wise Adaptive Spiking Neural Networks
94	HyperFeel: An Efficient Federated Learning Framework Using Hyperdimensional Computing
96	Evaluating Weakly Supervised Object Localization Methods Right? A Study on Heatmap-based XAI and Neural Backed Decision Tree
97	Pushing the Limits of Fewshot Anomaly Detection in Industry Vision: Graphcore
104	Transcendental Idealism of Planner: Evaluating Perception from Planning Perspective for Autonomous Driving
105	Group DETR: Fast DETR Training with Group-Wise One-to-Many Assignment
107	Motion-inductive Self-supervised Object Discovery in Videos
108	Functional Relation Field: A Model-Agnostic Framework for Multivariate Time Series Forecasting
113	Sparse and Hierarchical Masked Modeling for Convolutional Representation Learning
116	H2RBox: Horizonal Box Annotation is All You Need for Oriented Object Detection
117	Achieve the Minimum Width of Neural Networks for Universal Approximation
118	Reward Learning with Trees: Methods and Evaluation
119	Refining Visual Representation for Generalized Zero-Shot Recognition through Implicit-Semantics-Guided Metric Learning
120	Grassmannian Class Representation in Deep Learning
122	Communication Efficient Fair Federated Recommender System
125	MaPLe: Multi-modal Prompt Learning
127	Defactorization Transformer: Modeling Long Range Dependency with Local Window Cost
128	Suppressing the Heterogeneity: A Strong Feature Extractor for Few-shot Segmentation
129	Interpretable Single/Multi-label Text Classification with Unsupervised Constituent-label alignments
130	Slimmable Networks for Contrastive Self-supervised Learning
131	Design of the topology for contrastive visual-textual alignment
132	On the Calibration Set Difficulty and Out-of-distribution Calibration
133	Confidence and Dispersity Speak: Characterising Prediction Matrix for Unsupervised Accuracy Estimation
135	Universal Unlearnable Examples: Cluster-wise Perturbations without Label-consistency
139	ThinkSum: Probabilistic reasoning over sets using large language models
141	Expanding Datasets With Guided Imagination
143	BEVDistill: Cross-Modal BEV Distillation for Multi-View 3D Object Detection
144	Multiscale Pyramid Representation on Graphs: a Graph Sampling and Filtering Approach
145	Succinct Compression: Lossless Compression for Fast and Memory-Efficient Deep Neural Network Inference
146	Feint in Multi-Player Games
148	CLIP2Point: Transfer CLIP to Point Cloud Classification with Image-Depth Pre-training
149	Partial transportability for domain generalization
150	TT-NF: Tensor Train Neural Fields
151	S-SOLVER: Numerically Stable Adaptive Step Size Solver for Neural ODEs
152	Logical Entity Representation in Knowledge-Graphs for Differentiable Rule Learning
153	MixQuant: A Quantization Bit-width Search that Can Optimize the Performance of your Quantization Method
154	Learning a 3D-Aware Encoder for Style-based Generative Radiance Field
155	STViT: Semantic Tokens for Efficient Global and Local Vision Transformers
156	Minimax Optimal Kernel Operator Learning via Multilevel Training
158	Boosting Out-of-Distribution Detection with Multiple Pre-trained Models 
159	DOTIN: Dropping Out Task-Irrelevant Nodes for GNNs
160	Learning Domain-Agnostic Representation for Disease Diagnosis
161	Attention De-sparsification Matters: Inducing Diversity in Digital Pathology Representation Learning
163	CI-VAE: a Class-Informed Deep Variational Autoencoder for Enhanced Class-Specific Data Interpolation
164	Individual Privacy Accounting for Differentially Private Stochastic Gradient Descent
166	Measuring Asymmetric Gradient Discrepancy in Parallel Continual Learning
167	Optimizing Server-side Aggregation For Robust Federated Learning via Subspace Training
168	TaskPrompter: Spatial-Channel Multi-Task Prompting for Dense Scene Understanding
169	Efficient Automatic Machine Learning via Design Graphs
174	A Unified Framework of Soft Threshold Pruning
175	Self-attentive Rationalization for Graph Contrastive Learning
177	DropIT: Dropping Intermediate Tensors for Memory-Efficient DNN Training
178	Learning GFlowNets from partial episodes for improved convergence and stability
179	On Stability and Generalization of Bilevel Optimization Problems
181	Harnessing Out-Of-Distribution Examples via Augmenting Content and Style
182	Robust Generalization against Corruptions via Worst-Case Sharpness Minimization
183	Sharpness-aware Quantization for Deep Neural Networks
187	Improving Corruption Robustness with Adversarial Feature Alignment Transformers
189	Neural Shape Compiler: A Unified Framework for Transforming between Text, Point Cloud, and Program
192	Semantic Grouping Network for Audio Source Separation
193	DrML: Diagnosing and Rectifying Vision Models using Language
195	ClusTR: Exploring Efficient Self-attention via Clustering for Vision Transformers
197	On the Dynamics under the Averaged Sample Margin Loss and Beyond
198	Learning Implicit Scale Conditioned Memory Compensation for Talking Head Generation
200	Robustness Exploration of Semantic Information in Adversarial Training
203	Rotation Invariant Quantization for Model Compression
204	Trainability Preserving Neural Pruning
206	Distilling Text-Image Foundation Models
207	Hybrid Neuro-Symbolic Reasoning based on Multimodal Fusion
208	Sparse Misinformation Detector
209	Examining the Value of Neural Filter Pruning -- Retrospect and Prospect
210	Image as Set of Points
211	Probing into Overfitting for Video Recognition
212	(LA)YER-NEIGH(BOR) SAMPLING: DEFUSING NEIGHBORHOOD EXPLOSION
214	MapTR: Structured Modeling and Learning for Online Vectorized HD Map Construction
216	IDEAL: Query-Efficient Data-Free Learning from Black-Box Models
217	Correcting the Sub-optimal Bit Allocation
218	 Decompose to Generalize: Species-Generalized Animal Pose Estimation
219	Learnable Behavior Control: Breaking Atari Human World Records via Sample-Efficient Behavior Selection
220	IS SYNTHETIC DATA FROM GENERATIVE MODELS READY FOR IMAGE RECOGNITION?
221	Normalized Activation Function: Toward Better Convergence
222	Steering Prototypes with Prompt Tuning for Rehearsal-free Continual Learning
224	KNN-Diffusion: Image Generation via Large-Scale Retrieval
225	Unveiling The Mask of Position-Information Pattern Through the Mist of Image Features
226	Abstract-to-Executable Trajectory Translation for One-Shot Task Generalization
227	Bit-Pruning: A Sparse Multiplication-Less Dot-Product
228	DELTA: DEBIASED FULLY TEST-TIME ADAPTATION
231	kaBEDONN: posthoc eXplainable Artificial Intelligence with Data Ordered Neural Network
233	Cross-Level Distillation and Feature Denoising for Cross-Domain Few-Shot Classification
234	Module-wise Training of Residual Networks via the Minimizing Movement Scheme
235	Parameterized projected Bellman operator
236	The Biased Artist: Exploiting Cultural Biases via Homoglyphs in Text-Guided Image Generation Models
237	Unsupervised Learning of Causal Relationships from Unstructured Data
245	An Empirical Study of Metrics to Measure Representational Harms in Pre-Trained Language Models
246	Is Self-Supervised Contrastive Learning More Robust Than Supervised Learning?
249	Training A Multi-stage Deep Classifier with Feedback Signals
250	QCRS: Improve Randomized Smoothing using Quasi-Concave Optimization
252	AutoSKDBERT: Learn to Stochastically Distill BERT
253	Domain Generalization via Independent Regularization from Early-branching Networks
254	Real-Time Image Demoir$\acute{e}$ing on Mobile Devices
255	Towards Sustainable Self-supervised Learning
257	SoundNeRirF: Receiver-to-Receiver Sound Neural Room Impulse Response Field
258	SoundCount: Sound Counting from Raw Audio with Dyadic Decomposition Neural Network
259	Active Topological Mapping by Metric-Free Exploration via Task and Motion Imitation
260	Object Localization helps Action Recognition Models Adapt to New Environments
261	ChiroDiff: Modelling chirographic data with Diffusion Models
264	Neural-Symbolic Recursive Machine for Systematic Generalization
265	WaGI: Wavelet-based GAN Inversion for Preserving High-Frequency Image Details
266	Global Prototype Encoding for Incremental Video Highlights Detection
267	PatchDCT: Patch Refinement for High Quality Instance Segmentation
268	Dilated convolution with learnable spacings
273	"Faster Neural Architecture ""Search"" for Deep Image Prior"
274	Rotamer Density Estimators are Unsupervised Learners of the Effect of Mutations on Protein-Protein Interaction
275	Training Instability and Disharmony Between ReLU and Batch Normalization
276	Fairness-aware Contrastive Learning with Partially Annotated Sensitive Attributes
277	ViTKD: Practical Guidelines for ViT Feature Knowledge Distillation
279	DifFace: Blind Face Restoration with Diffused Error Contraction
281	FreeSeg: Free Mask from Interpretable Contrastive Language-Image Pretraining for Semantic Segmentation
283	Hardware-restriction-aware training (HRAT) for memristor neural networks
284	Bayesian Robust Graph Contrastive Learning
285	Double dynamic sparse training for GANs
286	SpQAT: A Sparse Quantization-Aware Training Method
287	HRDFuse: Monocular 360$^\circ$ Depth Estimation by Collaboratively Learning Holistic-with-Regional Depth Distributions
288	Learnable Topological Features For Phylogenetic Inference via Graph Neural Networks
289	EyeDAS: Securing Perception of Autonomous Cars Against the Stereoblindness Syndrome
290	SegNeRF: 3D Part Segmentation with Neural Radiance Fields
291	CD-Depth: Unsupervised Domain Adaptation for Depth Estimation via Cross Domain Integration
294	A Simple and Provable Method to Adapt Pre-trained Model across Domains with Few Samples
296	BoxTeacher: Exploring High-Quality Pseudo Labels for Weakly Supervised Instance Segmentation
301	MCAL: Minimum Cost Human-Machine Active Labeling
305	Approximated Anomalous Diffusion: Gaussian Mixture Score-based Generative Models
307	The Devil is in the Wrongly-classified Samples: Towards Unified Open-set Recognition
308	Domain Specific Denoising Diffusion Probabilistic Models for Brain Dynamics
309	Multi-User Reinforcement Learning with Low Rank Rewards
311	Function-Consistent Feature Distillation
313	Learn to Know Unknowns: A Bionic Memory Network for Unsupervised Anomaly Detection
315	Hierarchical Relational Learning for Few-Shot Knowledge Graph Completion
316	Cutting Long Gradient Flows: Decoupling End-to-End Backpropagation Based on Supervised Contrastive Learning
317	An Image is Worth One Word: Personalizing Text-to-Image Generation using Textual Inversion
318	Neural ePDOs: Spatially Adaptive Equivariant Partial Differential Operator Based  Networks
319	DeepSAT: An EDA-Driven Learning Framework for SAT
320	Neural Networks and the Chomsky Hierarchy
321	GFlowNets and variational inference
322	Volumetric Optimal Transportation by Fast Fourier Transform
323	Variational Autoencoders with Decremental Information Bottleneck for Disentanglement
324	Everyone's Preference Changes Differently: Weighted Multi-Interest Retrieval Model
326	Towards a Unified View on Visual Parameter-Efficient Transfer Learning
328	Generaling Multimodal Variational Methods to Sets
329	Token Turing Machines
331	AQUILA: Communication Efficient Federated Learning with Adaptive Quantization of Lazily-Aggregated Gradients
332	OhMG: Zero-shot Open-vocabulary Human Motion Generation
333	Decoupling Concept Bottleneck Model
336	Self-conditioned Embedding Diffusion for Text Generation
337	Neural Collapse Inspired Feature-Classifier Alignment for Few-Shot Class-Incremental Learning
338	Bidirectional Learning for Offline Model-based Biological Sequence Design
339	Self-supervised Video Representation Learning with Motion-Aware Masked Autoencoders
340	On The Inadequacy of Optimizing Alignment and Uniformity in Contrastive Learning of Sentence Representations
341	CAN: A simple, efficient and scalable contrastive masked autoencoder framework for learning visual representations
344	Smooth-Reduce: Leveraging Patches for Improved Certified Robustness
345	CLIP-FLOW: CONTRASTIVE LEARNING WITH ITERATIVE PSEUDO LABELING FOR OPTICAL FLOW
346	Stochastic Differentially Private and Fair Learning
349	Sample Complexity of Nonparametric Off-Policy Evaluation on Low-Dimensional Manifolds using Deep Networks
350	E-CRF: Embedded Conditional Random Field for Boundary-caused Class Weights Confusion in Semantic Segmentation
352	Understanding Self-Supervised Pretraining with Part-Aware Representation Learning
353	Calibrating Multimodal Learning
354	Semi-supervised Counting via Pixel-by-pixel Density Distribution Modelling
355	Unified Vision and Language Prompt Learning
356	Neural Groundplans: Persistent Neural Scene Representations from a Single Image
357	Extracting Robust Models with Uncertain Examples
358	Re-balancing Adversarial Training Over Unbalanced Datasets
359	Nearing or Surpassing: Overall Evaluation of Human-Machine Dynamic Vision Ability
361	Gradient Estimation for Unseen Domain Risk Minimization with Pre-Trained Models
362	Parameter Averaging for Feature Ranking
363	Out-of-distribution Detection with Implicit Outlier Transformation
366	Cross-Domain Autonomous Driving Perception using Contrastive Appearance Adaptation
367	Alternating Differentiation for Optimization Layers
368	Measuring axiomatic identifiability of counterfactual image models
369	ImageNet-E: Benchmarking Neural Network Robustness via Attribute Editing
370	Activation Function: Absolute Function,One Function Behaves more Individualized
371	Rethinking skip connection model as a learnable Markov chain
373	Revisiting the Entropy Semiring for Neural Speech Recognition
376	WeightRelay: Efficient Heterogenous Federated Learning on Time Series
377	Demystifying the Optimization and Generalization of Deep PAC-Bayesian Learning
378	Multiple output samples for each input in a single-output Gaussian process
379	GANet: Graph-Aware Network for Point Cloud Completion with Displacement-Aware Point Augmentor
382	Shared Knowledge Lifelong Learning
383	Multiplane NeRF-Supervised Disentanglement of Depth and Camera Pose from Videos
384	De Novo Molecular Generation via Connection-aware Motif Mining
385	An Analysis of Information Bottlenecks
386	MS3: A Multimodal Supervised Pretrained Model for Semantic Segmentation
388	Provable Adaptivity in Adam
389	CompletionFormer: Depth Completion with Convolutions and Vision Transformers
390	TiDAL: Learning Training Dynamics for Active Learning
391	Token Merging: Your ViT But Faster
392	Gradient Norm Regularizer Seeks Flat Minima and Improves Generalization
393	NICO++: Towards Better Benchmarking for Domain Generalization
394	CLIP-PAE: Projection-Augmentation Embedding to Extract Relevant Features for a Disentangled, Interpretable and Controllable Text-Guided Image Manipulation
395	Lossless Dataset Compression Via Dataset Quantization
396	DIVISION: Memory Efficient Training via Dual Activation Precision
397	SOM-CPC: Unsupervised Contrastive Learning with Self-Organizing Maps for Structured Representations of High-Rate Time Series
398	MiSAL: Active Learning for Every Budget
400	Limitless Stability for Graph Convolutional Networks 
401	Momentum in Momentum for Adaptive Optimization
402	EAGLE: Large-scale Learning of Turbulent Fluid Dynamics with Mesh Transformers
403	A Close Look at Token Mixer: From Attention to Convolution
404	Exploring Neural Network Representational Similarity using Filter Subspaces
408	Topology-aware robust optimization
409	STREET: A MULTI-TASK STRUCTURED REASONING AND EXPLANATION BENCHMARK
410	AdPE: Adversarial Positional Embeddings for Pretraining Vision Transformers via MAE+
411	Voting from Nearest Tasks: Meta-Vote Pruning of Pretrained Models for Downstream Tasks
412	Does Continual Learning Equally Forget All Parameters?
413	Learning Antidote Data to Individual Unfairness
415	Robust and Controllable Object-Centric Learning through Energy-based Models
420	ISS: Image as Stepping Stone for Text-Guided 3D Shape Generation
422	$1\times1$ Convolution is All You Need for Image Super-Resolution
423	Uncertainty Calibration via Knowledge Flow under Long-tailed Distribution
424	Empowering Networks With Scale and Rotation Equivariance Using A Similarity Convolution
426	Contrastive Continuity on Augmentation Stability Rehearsal for Continual Self-Supervised Learning
427	A simple but effective and efficient global modeling paradigm for image restoration
428	Guide Detectors in Pixel Space with Global Positioning and Abductive Matching
429	PEER: A Collaborative Language Model
430	FlexPose: Pose Distribution Adaptation with Few-shot Guidance
431	Structure-Sensitive Graph Dictionary Embedding for Graph Classification
432	Sparse Mixture-of-Experts are Domain Generalizable Learners
433	Efficient Covariance Estimation for Sparsified Functional Data
434	SWORD: Demystify the Secrets of Open-world Instance Recognition
436	Revisiting Higher-Order Gradient Methods for Multi-Agent Reinforcement Learning
437	The Benefits of Model-Based Generalization in Reinforcement Learning
438	SQA3D: Situated Question Answering in 3D Scenes
439	Learning to Compose Soft Prompts for Compositional Zero-Shot Learning
441	MultiWave: Multiresolution Deep Architectures through Wavelet Decomposition for Multivariate Timeseries Forecasting and Prediction
443	Label Distribution Learning via Implicit Distribution Representation
444	3D-Scene-Entities: Using Phrase-to-3D-Object Correspondences for Richer Visio-Linguistic Models in 3D Scenes
445	Token-Label Alignment for Vision Transformers
446	Gamma Sampling: Fine-grained Controlling Language Models without Training
447	Time Series are Images: Vision Transformer for Irregularly Sampled Time Series
448	Mind the Gap: Offline Policy Optimizaiton for Imperfect Rewards
449	Generating Diverse Cooperative Agents by Learning Incompatible Policies
451	Hyperbolic Binary Neural Network
452	One Transformer Can Understand Both 2D & 3D Molecular Data
453	Rethinking the Expressive Power of GNNs via Graph Biconnectivity
458	Selective Classification Via Neural Network Training Dynamics
459	Decomposing Texture and Semantics for Out-of-distribution Detection
460	Convergence of the mini-batch SIHT algorithm
461	Hierarchical Prompting Improves Visual Recognition On Accuracy, Data Efficiency and Explainability
462	Revocable Deep Reinforcement Learning with Affinity Regularization for Outlier-Robust Graph Matching
463	3D generation on ImageNet
464	Domain Generalization with Small Data
466	Curriculum Reinforcement Learning via Morphology-Environment Co-Evolution
467	Formulating and Proving the Trend of DNNs Learning Simple Concepts
469	Distilling Cognitive Backdoor within an Image
470	An information-theoretic approach to unsupervised keypoint representation learning
471	VectorMapNet: End-to-end Vectorized HD Map Learning
473	On the Lower Bound of Minimizing Polyak-Łojasiewicz functions
474	Stealing and Defending Transformer-based Encoders
476	ModelAngelo: Automated Model Building for Cryo-EM Maps
477	Twofer: Tackling Continual Domain Shift with Simultaneous Domain Generalization and Adaptation
478	Neural Sorting Networks with Error-Free Differentiable Swap Functions
479	LSAP: Rethinking Inversion Fidelity, Perception and Editability in GAN Latent Space
480	ManiSkill2: A Unified Benchmark for Generalizable Manipulation Skills
483	Stable, Efficient, and Flexible Monotone Operator Implicit Graph Neural Networks
484	GENERALIZED MATRIX LOCAL LOW RANK REPRESENTATION BY RANDOM PROJECTION AND SUBMATRIX PROPAGATION
485	A Fairness Analysis on Differentially Private Aggregation of Teacher Ensembles
486	Variational Reparametrized Policy Learning with Differentiable Physics
488	Conditional Positional Encodings for Vision Transformers
490	Unfixed Bias Iterator: A New Iterative Format
492	Tree Structure LSTM for Chinese Named Entity Recognition
493	Graph Contrastive Learning with Personalized Augmentation
495	Voxurf: Voxel-based Efficient and Accurate Neural Surface Reconstruction
496	Benchmarking Deformable Object Manipulation with Differentiable Physics
498	Clustering Structure Identification With Ordering Graph
499	Semi-Supervised Semantic Segmentation via Boosting Uncertainty on Unlabeled Data
500	Nearly Minimax Optimal Offline Reinforcement Learning with Linear Function Approximation: Single-Agent MDP and Markov Game
501	Spurious Local Minima Provably Exist for Deep Convolutional Neural Networks
503	EVA3D: Compositional 3D Human Generation from 2D Image Collections
504	A Class-Aware Representation Refinement Framework for Graph Classification
505	DPM-Solver++: Fast Solver for Guided Sampling of Diffusion Probabilistic Models
506	Learning Axis-Aligned Decision Trees with Gradient Descent
507	Active Learning with Controllable Augmentation Induced Acquisition
508	Linear Convergence of Natural Policy Gradient Methods with Log-Linear Policies
510	No Reason for No Supervision: Improved Generalization in Supervised Models
511	Uncertainty-Driven Active Vision for Implicit Scene Reconstruction
512	Generalizability of Adversarial Robustness Under Distribution Shifts
513	Prompt-driven efficient Open-set Semi-supervised Learning
514	 Topologically faithful image segmentation via induced matching of persistence barcodes
515	Learning Lightweight Object Detectors via Progressive Knowledge Distillation
516	Hard Regularization to Prevent Collapse in Online Deep Clustering without Data Augmentation
518	What shapes the loss landscape of self supervised learning?
525	Set Discrimination Contrastive Learning
526	Provable Benefits of Representational Transfer in Reinforcement Learning
527	Revisiting Group Robustness: Class-specific Scaling is All You Need
528	Interpretability with full complexity by constraining feature information
529	Meta-Evolve: Continuous Robot Evolution for One-to-many Policy Transfer
530	Explainable Artificial Intelligence: Reaping the Fruits of Decision Trees
533	SELF-SUPERVISED PRETRAINING FOR DIFFERENTIALLY PRIVATE LEARNING
534	Supervised Contrastive Regression
535	Q-Match: Self-Supervised Learning For Tabular Data by Matching Distributions Induced by a Queue
536	Block-level Stiffness Analysis of Residual Networks
537	MocoSFL: enabling cross-client collaborative self-supervised learning
538	MECTA: Memory-Economic Continual Test-Time Model Adaptation
539	Temporary feature collapse phenomenon in early learning of MLPs
540	GAIN: Enhancing Byzantine Robustness in Federated Learning with Gradient Decomposition
541	MMCAP: LEARNING TO BROAD-SIGHT NEURAL NETWORKS BY CLASS ATTENTION POOLING
542	QFuture: Learning Future Expectations in Multi-Agent Reinforcement Learning
544	Multimodal Analogical Reasoning over Knowledge Graphs
