number	title
1795	MULTILEVEL XAI: VISUAL AND LINGUISTIC BONDED EXPLANATIONS
1796	Momentum Diminishes the Effect of Spectral Bias in Physics-Informed Neural Networks
1797	Universal approximation and model compression for radial neural networks 
1798	Regularizing hard examples improves robustness
1799	Koopman neural operator for learning non-linear partial differential equations
1800	MESSAGENET: MESSAGE CLASSIFICATION USING NATURAL LANGUAGE PROCESSING AND META-DATA
1801	Local Attention Layers for Vision Transformers
1802	Revitalize Region Feature for Democratizing Video-language Pre-training of Retrieval
1803	BAMBI: Vertical Federated Bilevel Optimization with Privacy-Preserving and Computation Efficiency
1805	Decentralized Online Bandit Optimization on Directed Graphs with Regret Bounds
1806	Heterogeneous Continual Learning
1807	Learning Transferable Spatiotemporal Representations from Natural Script Knowledge
1809	CorruptEncoder: Data Poisoning Based Backdoor Attacks to Contrastive Learning
1810	Learning Instance-Solution Operator For Optimal Control
1811	TabCaps: A Capsule Neural Network for Tabular Data Classification with BoW Routing
1812	FedCL: Critical Learning Periods-aware Adaptive Client Selection in Federated Learning
1813	ObPose: Leveraging Pose for Object-Centric Scene Inference and Generation in 3D
1816	M$^3$Video: Masked Motion Modeling for Self-Supervised Video Representation Learning
1817	Programmatically Grounded, Compositionally Generalizable Robotic Manipulation
1818	Emergent world representations: Exploring a sequence model trained on a synthetic task
1819	Learning Diverse and Effective Policies with Non-Markovian Rewards
1820	Distraction is All You Need For Fairness
1821	Improve learning combining crowdsourced labels by weighting Areas Under the Margin
1822	Bringing Saccades and Fixations into Self-supervised Video Representation Learning
1823	Enhancing Robustness of Deep Networks Based on a Two-phase Model of Their Training with Noisy Labels
1824	GOOD: Exploring geometric cues for detecting objects in an open world
1825	Clifford Neural Layers for PDE Modeling
1826	Logit Clipping for Robust Learning against Label Noise
1827	Towards Skilled Population Curriculum for MARL
1828	3D Segmenter: 3D Transformer based Semantic Segmentation via 2D Panoramic Distillation
1829	What can be learnt with wide convolutional neural networks?
1833	Single-Stage Open-world Instance Segmentation with Cross-task Consistency Regularization
1834	EIT: Enhanced Interactive Transformer for Sequence Generation
1835	Efficient Federated Domain Translation 
1837	Fuzzy Alignments in Directed Acyclic Graph for Non-Autoregressive Machine Translation
1838	FaceMAE: Privacy-Preserving Face Recognition via Masked Autoencoders
1839	Differentiable Meta-Logical Programming
1840	 Robust Constrained Reinforcement Learning
1842	Conditional Antibody Design as 3D Equivariant Graph Translation
1843	HyperMAML: Few-Shot Adaptation of Deep Models with Hypernetworks
1844	Iterative Patch Selection for High-Resolution Image Recognition
1845	On the Fast Convergence of Unstable Reinforcement Learning Problems
1847	Uncertainty-based Multi-Task Data Sharing for Offline Reinforcement Learning
1851	Take 5: Interpretable Image Classification with a Handful of Features
1852	Unified Discrete Diffusion for Simultaneous Vision-Language Generation
1853	VLG: General Video Recognition with Web Textual Knowledge
1854	A Robust Stacking Framework for Training Deep Graph Models with Multifaceted Node Features
1855	AdaptFSP: Adaptive Fictitious Self Play
1856	OoD-Control: Out-of-Distribution Generalization for Adaptive UAV Flight Control
1857	Revisiting Pretraining Objectives for Tabular Deep Learning
1858	Improving Deep Regression with Ordinal Entropy
1859	AnyDA: Anytime Domain Adaptation
1860	Inferring Causal Relations between Temporal Events
1861	How to Exploit Hyperspherical Embeddings for Out-of-Distribution Detection?
1862	DoE2Vec: Representation Learning for Exploratory Landscape Analysis
1864	Understanding Hindsight Goal Relabeling Requires Rethinking Divergence Minimization
1866	Long-Tailed Learning Requires Feature Learning
1867	Learning Human-Compatible Representations for Case-Based Decision Support
1868	ISAAC Newton: Input-based Approximate Curvature for Newton's Method
1869	Music-to-Text Synaesthesia: Generating Descriptive Text from Music Recordings
1870	DEEPER-GXX: DEEPENING ARBITRARY GNNS
1871	LMC: Fast Training of GNNs via Subgraph Sampling with Provable Convergence
1872	Take One Gram of Neural Features, Get Enhanced Group Robustness
1873	SYNG4ME: Model Evaluation using Synthetic Test Data
1874	Enhance Local Consistency for Free: A Multi-Step Inertial Momentum Approach
1875	Imitation Improvement Learning for  Large-scale Capacitated Vehicle Routing Problems
1876	Points2NeRF: Generating Neural Radiance Fields from 3D point cloud
1877	VC Theoretical Explanation of Double Descent
1878	"""Why did the Model Fail?"": Attributing Model Performance Changes to Distribution Shifts"
1879	Trading Information between Latents in Hierarchical Variational Autoencoders
1880	Complex-Target-Guided Open-Domain Conversation based on offline reinforcement learning
1881	Analyzing the Effects of Classifier Lipschitzness on Explainers
1882	Robust Neural ODEs via Contractivity-promoting Regularization
1883	DM-NeRF: 3D Scene Geometry Decomposition and Manipulation from 2D Images
1884	Novel View Synthesis with Diffusion Models
1885	Asynchronous Gradient Play in Zero-Sum Multi-agent Games
1886	Towards Realtime Distributed Virtual Flow Meter via Compressed Continual Learning
1887	Fooling SHAP with Stealthily Biased Sampling
1888	Monotonicity and Double Descent in Uncertainty Estimation with Gaussian Processes
1889	Causal Inference via Nonlinear Variable Decorrelation in Healthcare
1890	Inducing Gaussian Process Networks
1891	Continual Unsupervised Disentangling of Self-Organizing Representations
1893	Point-based Molecular Representation Learning from Conformers
1894	Multi-Objective Reinforcement Learning: Convexity, Stationarity and Pareto Optimality
1895	A unified optimization framework of ANN-SNN Conversion: towards optimal mapping from activation values to firing rates
1897	Robust Attention for Contextual Biased Visual Recognition
1898	NANSY++: Unified Voice Synthesis with Neural Analysis and Synthesis
1899	DecAF: Joint Decoding of Answers and Logical Forms for Question Answering over Knowledge Bases
1900	Learning with MISELBO: The Mixture Cookbook
1902	Flow Annealed Importance Sampling Bootstrap
1903	Learning with Instance-Dependent Label Noise: Balancing Accuracy and Fairness
1904	Adversarial Detector for Decision Tree Ensembles Using Representation Learning
1905	ManyDG: Many-domain Generalization for Healthcare Applications
1906	Omnigrok: Grokking Beyond Algorithmic Data
1907	Model-based Value Exploration in Actor-critic Deep Reinforcement Learning
1908	Deep Reinforcement learning on Adaptive Pairwise Critic and Asymptotic Actor
1910	GAIN: On the Generalization of Instructional Action Understanding
1911	Code Translation with Compiler Representations
1912	Sequential Latent Variable Models for Few-Shot High-Dimensional Time-Series Forecasting
1913	Diffusing Graph Attention
1914	Certification of Attribution Robustness for Euclidean Distance and Cosine Similarity Measure
1915	Sign and Basis Invariant Networks for Spectral Graph Representation Learning
1916	Automaton Distillation: A Neuro-Symbolic Transfer Learning Approach for Deep RL
1917	Reward-free Policy Learning through Active Human Involvement
1918	Entropy-Regularized Model-Based Offline Reinforcement Learning
1920	Model ensemble instead of prompt fusion: a sample-specific knowledge transfer method for few-shot prompt tuning
1921	Scalable and Privacy-enhanced Graph Generative Model for Graph Neural Networks
1922	Spotting Expressivity Bottlenecks and Fixing Them Optimally 
1923	Hybrid RL: Using both offline and online data can make RL efficient
1924	Beyond calibration: estimating the grouping loss of modern neural networks
1925	LEARNING THE SPECTROGRAM TEMPORAL RESOLUTION FOR AUDIO CLASSIFICATION
1926	ON INJECTING NOISE DURING INFERENCE
1927	Stochastic Multi-Person 3D Motion Forecasting
1928	Landscape Learning for Neural Network Inversion
1929	Shape Analysis by Shadow Synthesis
1930	Improving Information Retention in Large Scale Online Continual Learning
1931	Diffusion Probabilistic Fields
1932	Convergence of Generative Deep Linear Networks Trained with Bures-Wasserstein Loss
1933	The Reward Hypothesis is False
1934	Unicom: Universal and Compact Representation Learning for Image Retrieval
1935	Robust Reinforcement Learning with Distributional Risk-averse formulation
1936	Parameter-varying neural ordinary differential equations with partition-of-unity networks
1937	Cross-Quality Few-Shot Transfer for Alloy Yield Strength Prediction: A New Material Science Benchmark and An Integrated Optimization Framework
1938	Learning Dynamic Query Combinations for Transformer-based Object Detection and Segmentation
1939	NeuralPCG: Learning Preconditioner for Solving Partial Differential Equations with Graph Neural Network
1940	Diagnosing and exploiting the computational demands of videos games for deep reinforcement learning
1941	Transferability Between Regression Tasks
1942	Transformer Meets Boundary Value Inverse Problems
1943	Distributionally Robust Post-hoc Classifiers under Prior Shifts
1944	On Convergence of Average-Reward Off-Policy Control Algorithms in Weakly-Communicating MDPs
1945	Impossibly Good Experts and How to Follow Them
1946	AIM: Adapting Image Models for Efficient Video Understanding
1947	Predictor-corrector algorithms for stochastic optimization under gradual distribution shift
1949	When does Bias Transfer in Transfer Learning?
1950	Multi-Agent Policy Transfer via Task Relationship Modeling
1951	RNAS-CL: Robust Neural Architecture Search by Cross-Layer Knowledge Distillation
1952	MAE are Secretly Efficient Learners
1953	Spatio-temporal Self-Attention for Egocentric 3D Pose Estimation
1954	Solving and Learning non-Markovian Stochastic Control problems in continuous-time with Neural RDEs
1955	What Can we Learn From The Selective Prediction And Uncertainty Estimation Performance Of 523 Imagenet Classifiers?
1956	Deep Generative Symbolic Regression
1957	Policy-Induced Self-Supervision Improves Representation Finetuning in Visual RL
1958	Analytical Composition of Differential Privacy via the Edgeworth Accountant
1960	Data Drift Correction via Time-varying Importance Weight Estimator
1961	Tangential Wasserstein Projections
1962	Learning for Edge-Weighted Online Bipartite Matching with Robustness Guarantees
1963	Fair Clustering via Equalized Confidence
1964	Causal discovery from conditionally stationary time series
1967	Posterior Sampling Model-based Policy Optimization under Approximate Inference
1968	To be robust and to be fair: aligning fairness with robustness
1969	InfoOT: Information Maximizing Optimal Transport
1970	ELRT: Towards Efficient Low-Rank Training for Compact Neural Networks
1971	Retrieval-based Controllable Molecule Generation
1972	Tessellated Neural Networks: A Robust Defence against Adversarial Attacks
1973	Simplifying Model-based RL: Learning Representations, Latent-space Models, and Policies with One Objective
1974	CEPD: Co-Exploring Pruning and Decomposition for Compact DNN Models
1975	SlotFormer: Unsupervised Visual Dynamics Simulation with Object-Centric Models
1976	Data Poisoning Attacks Against Multimodal Encoders
1977	A framework for benchmarking Class-out-of-distribution detection and its application to ImageNet
1978	Interval Bound Interpolation for Few-shot Learning with Few Tasks
1979	ProGen2: Exploring the Boundaries of Protein Language Models
1980	Predicting Drug Repurposing Candidates and Their Mechanisms from A Biomedical Knowledge Graph
1981	No Double Descent in PCA: Training and Pre-Training in High Dimensions
1982	Learning to Estimate Shapley Values with Vision Transformers
1983	KL-Entropy-Regularized RL with a Generative Model is Minimax Optimal
1984	FedDAR: Federated Domain-Aware Representation Learning
1985	Learning differentiable solvers for systems with hard constraints
1986	Convolutions are competitive with transformers for protein sequence pretraining
1987	Masked inverse folding with sequence transfer for protein representation learning
1988	Calibrating Sequence likelihood Improves Conditional Language Generation
1989	Neural Network Approximations of PDEs Beyond Linearity: Representational Perspective
1990	A Unified Framework for Comparing Learning Algorithms
1991	Equilibrium-finding via exploitability descent with learned best-response functions
1992	Neighborhood Gradient Clustering: An Efficient Decentralized Learning Method for Non-IID Data Distributions
1993	Understanding new tasks through the lens of training data via exponential tilting
1994	CUDA: Curriculum of Data Augmentation for Long-tailed Recognition
1995	Benchmarking Offline Reinforcement Learning on Real-Robot Hardware
1996	UNIFIED-IO: A Unified Model for Vision, Language, and Multi-modal Tasks
1997	Towards Identification of Microaggressions in real-life and Scripted conversations, using Context-Aware Machine Learning Techniques.
1998	D-CIPHER: Discovery of Closed-form Partial Differential Equations
1999	Semantic Video Synthesis from Video Scene Graphs
2001	How Much Space Has Been Explored? Measuring the Chemical Space Covered by Databases and Machine-Generated Molecules
2003	Efficient Reward Poisoning Attacks on Online Deep Reinforcement Learning
2004	ADVERSARIALLY BALANCED REPRESENTATION FOR CONTINUOUS TREATMENT EFFECT ESTIMATION
2005	Markup-to-Image Diffusion Models with Scheduled Sampling
2008	Certified Defences Against Adversarial Patch Attacks on Semantic Segmentation
2009	On the Performance of Temporal Difference Learning With Neural Networks
2011	Generating Adversarial Examples with Task Oriented Multi-Objective Optimization
2012	Agent-based Graph Neural Networks
2013	Quantum Fourier Networks for solving Parametric PDEs
2015	Masked Vision and Language Modeling for Multi-modal Representation Learning
2016	Find Your Friends: Personalized Federated Learning with the Right Collaborators
2017	Neural Embeddings for Text
2018	Generated Graph Detection
2019	Decentralized Robust V-learning for Solving Markov Games with Model Uncertainty
2020	Contrastive Prompt Tuning Improves Generalization in Vision-Language Models
2021	Bridge the Inference Gaps of Neural Processes via Expectation Maximization
2022	InCoder: A Generative Model for Code Infilling and Synthesis
2023	Learning Control Policies for Region Stabilization in Stochastic Systems
2024	Output Distribution over the Entire Input Space: A Novel Perspective to Understand Neural Networks
2025	Beyond Traditional Transfer Learning: Co-finetuning for Action Localisation
2026	Knowledge-Driven New Drug Recommendation
2027	Provable Memorization Capacity of Transformers
2028	Hyperbolic Contrastive Learning for Visual Representations beyond Objects
2029	What does a platypus look like? Generating customized prompts for zero-shot image classification
2030	Generative Modeling Helps Weak Supervision (and Vice Versa)
2031	Learning to Grow Pretrained Models for Efficient Transformer Training
2033	In-Context Policy Iteration
2034	Progressive Transformation Learning For Leveraging Virtual Images in Training
2035	FAME: Fast Adaptive Moment Estimation based on Triple Exponential Moving Average
2036	ON COMPLEX-DOMAIN CNN REPRESENTATIONS FOR CLASSIFYING REAL/COMPLEX-VALUED DATA
2037	Early Stopping for Deep Image Prior
2038	FoSR: First-order spectral rewiring for addressing oversquashing in GNNs
2040	Are Neurons Actually Collapsed? On the Fine-Grained Structure in Neural Representations
2041	Algorithmic Determination of the Combinatorial Structure of the Linear Regions of ReLU Neural Networks
2042	FixEval: Execution-based Evaluation of Program Fixes for Competitive Programming Problems
2043	Near-optimal Policy Identification in Active Reinforcement Learning
2044	Explainable Recommender with Geometric Information Bottleneck
2045	On Emergence of Activation Sparsity in Trained Transformers
2046	FedDA: Faster Framework of Local Adaptive Gradient Methods via Restarted Dual Averaging
2047	Local Stochastic Bilevel Optimization with Momentum-Based Variance Reduction
2048	Towards Efficient Posterior Sampling in Deep Neural Networks via Symmetry Removal
2049	An Investigation of Domain Generalization with Rademacher Complexity
2050	Unravel Structured Heterogeneity of Tasks in Meta-Reinforcement Learning via Exploratory Clustering
2051	VoGE: A Differentiable Volume Renderer using Gaussian Ellipsoids for Analysis-by-Synthesis
2052	Learning Soft Constraints From Constrained Expert Demonstrations
2053	Sparse tree-based Initialization for Neural Networks
2054	Towards Global Optimality in Cooperative MARL with Sequential Transformation
2055	Continuized Acceleration for Quasar Convex Functions  in Non-Convex Optimization
2056	Thinking Two Moves Ahead: Anticipating Other Users Improves Backdoor Attacks in Federated Learning
2057	Constructive TT-representation of the tensors given as index interaction functions with applications
2058	Structured Pruning of CNNs at Initialization
2059	Inverse Kernel Decomposition
2060	Target-Free Ligand Scoring via One-Shot Learning
2063	Learning by Distilling Context
2064	An Upper Bound for the Distribution Overlap Index and Its Applications
2065	DiffDock: Diffusion Steps, Twists, and Turns for Molecular Docking
2066	Fair Federated Learning via Bounded Group Loss
2067	Dynamic Embeddings of Temporal High-Order Interactions via Neural Diffusion-Reaction Processes
2068	GLASU: A Communication-Efficient Algorithm for Federated Learning with Vertically Distributed Graph Data
2069	Meta-Learning in Games
2070	Min-Max Zero-Shot Multi-Label Classification
2071	RelationCLIP: Training-free Fine-grained Visual and Language Concept Matching
2072	Combinatorial-Probabilistic Trade-Off: P-Values of Community Properties Test in the Stochastic Block Models
2073	Adaptive Gradient Methods with Local Guarantees
2075	Are vision transformers more robust than CNNs for Backdoor attacks?
2076	Multi-Rate VAE: Train Once, Get the Full Rate-Distortion Curve
2077	The Convergence Rate of SGD's Final Iterate: Analysis on Dimension Dependence
2078	Compound Tokens: Channel Fusion for Vision-Language Representation Learning
2079	Lower Bounds for Differentially Private ERM: Unconstrained and Non-Euclidean
2080	GNNDelete: A General Unlearning Strategy for Graph Neural Networks
2082	Policy Architectures for Compositional Generalization in Control
2083	Bridging the Gap Between Cascade and End-to-End Cross-modal Translation Models: A Zero-Shot Approach
2084	SimA: Simple Softmax-free Attention For Vision Transformers
2085	Hybrid Federated Learning for Feature & Sample Heterogeneity: Algorithms and Implementation
2086	Countinuous pseudo-labeling from the start
2087	Graph Contrastive Learning Under Heterophily: Utilizing Graph Filters to Generate Graph Views
2088	Stable Target Field for Reduced Variance Score Estimation
2092	Distilling Model Failures as Directions in Latent Space
2093	On the Complexity of Bayesian Generalization
2094	Accelerating Adaptive Federated Optimization with Local Gossip Communications
2095	Relational Attention: Generalizing Transformers for Graph-Structured Tasks
2096	Offline Reinforcement Learning with Differential Privacy
2097	Causal Proxy Models For Concept-Based Model Explanations
2098	GeONet: a neural operator for learning the Wasserstein geodesic
2100	Minimum Curvature Manifold Learning
2101	Average Sensitivity of Decision Tree Learning
2102	ACMP: Allen-Cahn Message Passing with Attractive and Repulsive Forces for Graph Neural Networks
2103	The World is Changing: Improving Fair Training under Correlation Shifts
2105	Relational Curriculum Learning for Graph Neural Networks
2106	HYPERPRUNING: EFFICIENT PRUNING THROUGH LYAPUNOV METRIC HYPERSEARCH
2107	Dual Diffusion Implicit Bridges for Image-to-Image Translation
2108	PATCH-MIX TRANSFORMER FOR UNSUPERVISED DOMAIN ADAPTATION: A GAME PERSPECTIVE
2109	FINE: Future-Aware Inference for Streaming Speech Translation
2110	Hungry Hungry Hippos: Towards Language Modeling with State Space Models
2111	AxBERT: An Explainable Chinese Spelling Correction Method Driven by Associative Knowledge Network
2112	Representational Task Bias in Zero-shot Recognition at Scale
2113	The Modality Focusing Hypothesis: Towards Understanding Crossmodal Knowledge Distillation
2115	Adaptive Robust Evidential Optimization For Open Set Detection from Imbalanced Data
2116	Learning Math Reasoning from Self-Sampled Correct and Partially-Correct Solutions
2118	Cluster and Landmark Attributes Infused Graph Neural Networks for Link prediction
2119	Diving into Unified Data-Model Sparsity for Class-Imbalanced Graph Representation Learning
2120	Transformer Module Networks for Systematic Generalization in Visual Question Answering
2121	$$CONVOLUTION AND POOLING OPERATION MODULE WITH ADAPTIVE STRIDE PROCESSING EFFEC$$
2122	Speculative Decoding: Lossless Speedup of Autoregressive Translation
2124	MIMT: Masked Image Modeling Transformer for Video Compression
2125	Contrastive Novelty Learning: Anticipating Outliers with Large Language Models
2126	A Data-Based Perspective on Transfer Learning
2127	Unsupervised Visual Anomaly Detection with Score-Based Generative Model
2128	Visual Classification via Description from Large Language Models
2129	GENERATIVE OF ORIGIN MODEL DISTRIBUTION MASKED WITH EMOTIONS AND TOPICS DISTRIBUTION IN HYBRID METHOD
2130	On the Perils of Cascading Robust Classifiers
2131	SCALE-UP: An Efficient Black-box Input-level Backdoor Detection via Analyzing Scaled Prediction Consistency
2133	Recovering Top-Two Answers and Confusion Probability in Multi-Choice Crowdsourcing
2134	Beyond Counting Linear Regions of Neural Networks, Simple Linear Regions Dominate!
2135	Causal Knowledge Transfer from Task Affinity
2136	From Play to Policy: Conditional Behavior Generation from Uncurated Robot Data
2137	On the Neural Tangent Kernel of Equilibrium Models
2138	MaskConver: A Universal Panoptic and Semantic Segmentation Model with Pure Convolutions
2139	Concentric Ring Loss for Face Forgery Detection
2140	Substructured Graph Convolution for Non-overlapping Graph Decomposition
2142	How Does Adaptive Optimization Impact Local Neural Network Geometry?
2144	Behavior Prior Representation learning for Offline Reinforcement Learning
2145	RPM: Generalizable Behaviors for Multi-Agent Reinforcement Learning
2146	Agent-Controller Representations: Principled Offline RL with Rich Exogenous Information
2147	HotProtein: A Novel Framework for Protein Thermostability Prediction and Editing
2148	Data Valuation Without Training of a Model
2149	Progressive Voronoi Diagram Subdivision Enables Accurate Data-free Class-Incremental Learning
2150	Write and Paint: Generative Vision-Language Models are Unified Modal Learners
2151	MemoNav: Working Memory Model for Visual Navigation
2152	Clustering-Assisted Foreground and Background Separation for Weakly-supervised Temporal Action Localization
2153	Simple Yet Effective Graph Contrastive Learning for Recommendation
2155	Generalizable Person Re-identification Without Demographics
2156	Chasing Better Deep Image Priors Between Over- and Under-parameterization
2157	Can Language Models Make Fun? A Case Study in Chinese Comical Crosstalk
2159	Improving Language Model Pretraining with Text Structure Information
2160	Representing Multi-view Time-series Graph Structures for Multivariate Long-term Time-series Forecasting
2161	Rethinking the Structure of Stochastic Gradients: Empirical and Statistical Evidence
2162	Randomized Smoothing with Masked Inference for Adversarially Robust NLP Systems
2164	Distributionally Robust Recourse Action
2165	Personalized Federated Learning with Feature Alignment and Classifier Collaboration
2166	RegCLR: A Self-Supervised Framework for Tabular Representation Learning in the Wild
2167	Spiking Convolutional Neural Networks for Text Classification
2168	Temporally-Weighted Spike Encoding for Event-based Object Detection and Classification
2169	Data-efficient Supervised Learning is Powerful for Neural Combinatorial Optimization
2171	REPRESENTATIVE PROTOTYPE WITH CONSTRASTIVE LEARNING FOR SEMI-SUPENVISED FEW-SHOT CLASSIFICATION
2172	AutoFHE: Automated Adaption of CNNs for Efficient Evaluation over FHE
2173	EM-Network: Learning Better Latent Variable for Sequence-to-Sequence Models
2174	SpeedAug: A Simple Co-Augmentation Method for Unsupervised Audio-Visual Pre-training
2175	Ensuring DNN Solution Feasibility for Optimization Problems with Linear Constraints
2176	Self-Consistency Improves Chain of Thought Reasoning in Language Models
2177	Harnessing Mixed Offline Reinforcement Learning Datasets via Trajectory Weighting
2179	Covariance-Robust Minimax Probability Machines for Algorithmic Recourse
2180	Your Contrastive Learning Is Secretly Doing Stochastic Neighbor Embedding
2181	CircuitNet: A Generic Neural Network to Realize Universal Circuit Motif Modeling
2182	Domain-Specific Risk Minimization for Out-of-Distribution Generalization
2185	Supernet Training for Federated Image Classification Under System Heterogeneity
2186	SimForest:  An Efficient Plug-in to Boost Few-Shot Learning Performance
2187	Schema Inference for Interpretable Image Classification
2188	Feature-Driven Talking Face Generation with StyleGAN2
2189	Important Channel Tuning
2190	Few-Shot Learning with Representative Global Prototype
2191	Exploring Transformer Backbones for Heterogeneous Treatment Effect Estimation
2192	AVT: Audio-Video Transformer for Multimodal Action Recognition
2193	A Closer Look at the Calibration of Differentially Private Learners
2194	Out-of-distribution Representation Learning for Time Series Classification
