number	title
4294	Vector Quantization and Shifting: Exploiting Latent Properties to Optimize Neural Codecs
4296	Escaping saddle points in zeroth-order optimization:  two function evaluations suffice
4297	Interpreting Class Conditional GANs with Channel Awareness
4298	robust positive-unlabeled learning via noise negative sample self-correction
4299	Learning topology-preserving data representations
4300	SynBench: Task-Agnostic Benchmarking of Pretrained Representations using Synthetic Data
4301	Relaxed Attention for Transformer Models
4302	Reducing Communication Entropy in Multi-Agent Reinforcement Learning
4303	Sequential Learning of Neural Networks for Prequential MDL
4304	Irregularity Reflection Neural Network for Time Series Forecasting
4305	MILAN: Masked Image Pretraining on Language Assisted Representation
4306	Hierarchical Prototypes for  Unsupervised Dynamics Generalization in Model-Based Reinforcement Learning
4310	Representational Dissimilarity Metric Spaces for Stochastic Neural Networks
4311	Learning Interpretable Neural Discrete Representation for Time Series Classification
4312	Spatial Entropy as an Inductive Bias for Vision Transformers
4313	Learning Dictionaries over Datasets through Wasserstein Barycenters
4314	Localized Randomized Smoothing for Collective Robustness Certification
4315	SeKron: A Decomposition Method Supporting Many Factorization Structures
4317	Harnessing Client Drift with Decoupled Gradient Dissimilarity
4318	FedPD: Defying data heterogeneity through privacy distillation
4320	Counterfactual Explanation via Search in Gaussian Mixture Distributed Latent Space
4321	ExpressivE: A Spatio-Functional Embedding For Knowledge Graph Completion
4322	Why adversarial training can hurt robust accuracy
4323	Association Rules in QUBO Samples and Where to Find Them
4324	Distributed Inference and Fine-tuning of Large Language Models Over The Internet
4326	Differentiable and transportable structure learning
4327	Adversarial Driving Policy Learning by Misunderstanding the Traffic Flow
4329	Linearised Implicit Variational Inference
4330	Finding Generalization Measures by Contrasting Signal and Noise
4331	Graph Backup: Data Efficient Backup Exploiting Markovian Transitions
4333	Copy is All You Need
4334	Gradient flow in the gaussian covariate model: exact solution of learning curves and multiple descent structures
4335	Interactive Sequential Generative Models
4336	Leveraging Importance Weights in Subset Selection
4337	Towards Conditionally Dependent Masked Language Models
4338	Do You Remember? Overcoming Catastrophic Forgetting for Fake Audio Detection
4340	Annealed Fisher Implicit Sampler
4341	Simplicity bias leads to amplified performance disparities
4342	Correlative Information Maximization Based Biologically Plausible Neural Networks for Correlated Source Separation
4343	Improved Stein Variational Gradient Descent with Importance Weights
4344	Efficient Planning in a Compact Latent Action Space
4345	Enhancing the Inductive Biases of Graph Neural ODE for Modeling Dynamical Systems
4347	Analyzing Transformers in Embedding Space
4348	Contrastive Meta-Learning for Partially Observable Few-Shot Learning
4349	Guided Safe Shooting: model based reinforcement learning with safety constraints
4350	Selection-Inference: Exploiting Large Language Models for Interpretable Logical Reasoning
4353	Representation Balancing with Decomposed Patterns for Treatment Effect Estimation
4354	MetaPhysiCa: Causality-aware Robustness to OOD Initial Conditions in Physics-informed Machine Learning
4356	Prompt-Based Metric Learning for Few-Shot NER
4358	InteriorSim: A Photorealistic Simulator for Embodied AI
4359	Learning Privacy-Preserving Graph Embeddings Against Sensitive Attributes Inference
4360	Imitating Human Behaviour with Diffusion Models
4362	A Simple Nadaraya-Watson Head for Explainable and Calibrated Classification
4363	Causal Attention to Exploit Transient Emergence of Causal Effect
4364	Model Stealing Attacks Against Vision-Language Models
4365	Affinity-VAE for clustering and classification of objects in multidimensional image data
4366	Learning Robust Kernel Ensembles with Kernel Average Pooling
4367	Sample-efficient multi-objective molecular optimization with GFlowNets
4368	Understanding weight-magnitude hyperparameters in training  binary networks
4369	SEQuence-rPPG: A Fast BVP Signal Extraction Method From Frame Sequences
4370	This Looks Like It Rather Than That: ProtoKNN For Similarity-Based Classifiers
4372	DP-InstaHide: Data Augmentations Provably Enhance Guarantees Against Dataset Manipulations
4373	Towards Robust Model Watermark via Reducing Parametric Vulnerability
4374	Client-agnostic Learning and Zero-shot Adaptation for Federated Domain Generalization
4375	On the Robustness of Dataset Inference
4376	DBA: Efficient Transformer with Dynamic Bilinear Low-Rank Attention
4378	UNICORN: A Unified Backdoor Trigger Inversion Framework
4381	Latent Graph Inference using Product Manifolds
4382	Federated Learning as Variational Inference: A Scalable Expectation Propagation Approach
4384	Task-Agnostic Unsupervised Robust Representation Learning
4387	Identifiability Results for Multimodal Contrastive Learning
4388	A View From Somewhere: Human-Centric Face Representations
4389	Maximal Correlation-Based Post-Nonlinear Learning for Bivariate Causal Discovery
4391	Wasserstein Generalization Bound for Few-Shot Learning
4392	Multivariate Time Series Forecasting By Graph Attention Networks With Theoretical Guarantees
4394	CANIFE: Crafting Canaries for Empirical Privacy Measurement in Federated Learning
4395	Global-Scale Species Mapping From Crowdsourced Data
4396	Towards the Detection of Diffusion Model Deepfakes
4399	Few-shot Lifelong Reinforcement Learning with Generalization Guarantees: An Empirical PAC-Bayes Approach
4400	Affinity-Aware Graph Networks
4401	Enforcing Delayed-Impact Fairness Guarantees
4402	Towards Reliable Link Prediction with Robust Graph Information Bottleneck
4403	Edge Guided GANs with Contrastive Learning for Semantic Image Synthesis
4405	CLAS: Central Latent Action Spaces for Coordinated Multi-Robot Manipulation
4406	HyperDeepONet: learning operator with complex target function space using the limited resources via hypernetwork
4407	Hidden Markov Mixture of Gaussian Process Functional Regression: Utilizing Multi-Scale Structure for Time-Series Forecasting
4408	Causal Mean Field Multi-Agent Reinforcement Learning
4409	A NEW PARADIGM FOR CROSS-MODALITY PERSON RE-IDENTIFICATION
4410	Using Planning to Improve Semantic Parsing of Instructional Texts
4412	Robust and accelerated single-spike spiking neural network training with applicability to challenging temporal tasks
4413	Going Beyond Approximation: Encoding  Constraints for Explainable Multi-hop Inference via Differentiable Combinatorial Solvers
4414	Adaptive Smoothing Gradient Learning for Spiking Neural Networks
4415	Pseudo-label Training and Model Inertia in Neural Machine Translation
4417	Analyzing diffusion as serial reproduction
4418	Multi-Behavior Dynamic Contrastive Learning for Recommendation
4421	Autoregressive Generative Modeling with Noise Conditional Maximum Likelihood Estimation
4423	How robust is unsupervised representation learning to distribution shift?
4424	Probabilistically Robust Recourse: Navigating the Trade-offs between Costs and Robustness in Algorithmic Recourse
4425	A Self-Attention Ansatz for Ab-initio Quantum Chemistry
4428	Learning a Domain-Agnostic Policy through Adversarial Representation Matching for Cross-Domain Policy Transfer
4429	AE-FLOW: Autoencoders with Normalizing Flows  for  Medical Images Anomaly Detection 
4431	Continuously Parameterized Mixture Models
4432	SmilesFormer: Language Model for Molecular Design
4433	CounterNet: End-to-End Training of Prediction Aware Counterfactual Explanations
4434	Towards Federated Learning of Deep Graph Neural Networks
4435	Computing all Optimal Partial Transports
4436	On the Importance of Diversity in Data-free Model Stealing
4437	BiasPAD: A Bias-Progressive Auto-Debiasing Framework
4438	In-context Reinforcement Learning with Algorithm Distillation
4441	Enhanced Spatio-Temporal Image Encoding for Online Human Activity Recognition
4442	Inducing Meaningful Units from Character Sequences with Dynamic Capacity Slot Attention
4444	RoCourseNet: Distributionally Robust Training of a Prediction Aware Recourse Model
4445	BALTO: efficient tensor program optimization with diversity-based active learning
4448	Learning What and Where - Unsupervised Disentangling Location and Identity Tracking
4449	Renamer: A Transformer Architecture In-variant to Variable Renaming
4450	Uncertainty-aware off policy learning
4451	A GENERAL SCENARIO-AGNOSTIC REINFORCEMENT LEARNING FOR TRAFFIC SIGNAL CONTROL
4452	Learning to Cooperate and Communicate Over Imperfect Channels
4455	On the Trade-Off between Actionable Explanations and the Right to be Forgotten
4456	A Theory of Dynamic Benchmarks
4457	Marginal Probability Explanation: A Saliency Map with Closed-loop Validation
4458	Uncovering Directions of Instability via Quadratic Approximation of Deep Neural Loss in Reinforcement Learning
4459	Memory-Efficient Reinforcement Learning with Priority based on Surprise and On-policyness
4460	EPISODE: Episodic Gradient Clipping with Periodic Resampled Corrections for Federated Learning with Heterogeneous Data
4461	Solving Math Word Problems with Process-based and Outcome-based Feedback
4462	Human-AI Coordination via Human-Regularized Search and Learning
4463	Revisiting adapters with adversarial training
4464	Bidirectional Language Models Are Also Few-shot Learners
4465	Representation Power of Graph Convolutions : Neural Tangent Kernel Analysis
4466	Energy-Based Test Sample Adaptation for Domain Generalization
4467	A Higher Precision Algorithm for Computing the $1$-Wasserstein Distance
4468	Efficient Learning of Rationalizable Equilibria in General-Sum Games
4469	HiT-DVAE: Human Motion Generation via Hierarchical Transformer Dynamical VAE
4471	HypeR: Multitask Hyper-Prompted Training Enables Large-Scale Retrieval Generalization
4473	Online Boundary-Free Continual Learning by Scheduled Data Prior
4474	Achieve Near-Optimal Individual Regret & Low Communications in Multi-Agent Bandits
4476	CASA: Bridging the Gap between Policy Improvement and Policy Evaluation with Conflict Averse Policy Iteration
4477	Sublinear Algorithms for Kernel Matrices via Kernel Density Estimation
4478	Diffusion Policies as an Expressive Policy Class for Offline Reinforcement Learning
4480	Tackling Imbalanced Class in Federated Learning via Class Distribution Estimation
4481	Personalized federated composite learning with forward-backward envelopes
4482	Attention Based Models for Cell Type Classification on Single-Cell RNA-Seq Data
4484	Learning to Induce Causal Structure 
4485	Learning Stackelberg Equilibria and Applications to Economic Design Games
4486	Multi-stationary point losses for robust model
4487	Adversarial Cheap Talk
4488	Generalized Belief Transport
4489	No-Regret Learning in Strongly Monotone Games Converges to a Nash Equilibrium
4491	Variational Pseudo Labels for Meta Test-time Adaptation
4492	Would decentralization hurt generalization?
4493	Removing Backdoors in Pre-trained Models by Regularized Continual Pre-training
4494	Optimistic Exploration with Learned Features Provably Solves Markov Decision Processes with Neural Dynamics
4495	Self-Guided Diffusion Models
4496	Brain2GAN; Reconstructing perceived faces from the primate brain via StyleGAN3
4497	Efficient Discovery of Dynamical Laws in Symbolic Form
4498	Stay Moral and Explore: Learn to Behave Morally in Text-based Games
4499	Weighted Regularization for Efficient Neural Network Compression
4500	Towards a Unified Theoretical Understanding of Non-contrastive Learning via Rank Differential Mechanism
4501	Bridging the Gap to Real-World Object-Centric Learning
4502	Language Modeling Using Tensor Trains
4503	Towards Universal Visual Reward and Representation via Value-Implicit Pre-Training
4504	Internet-augmented language models through few-shot prompting for open-domain question answering
4505	Automatic Curriculum Generation for Reinforcement Learning in Zero-Sum Games
4506	Temporal Dynamics Aware Adversarial Attacks On Discrete-Time Graph Models
4507	Neuromechanical Autoencoders: Learning to Couple Elastic and Neural Network Nonlinearity
4508	AN OPERATOR NORM BASED PASSIVE FILTER PRUNING METHOD FOR EFFICIENT CNNS
4509	Batch Normalization Explained
4510	Active Learning based Structural Inference
4512	Strong inductive biases provably prevent harmless interpolation
4513	Self-supervised learning with rotation-invariant kernels
4514	Mesh-free Eulerian Physics-Informed Neural Networks
4515	 Continual Zero-shot Learning through Semantically Guided Generative Random Walks
4516	Exploring the Limits of Differentially Private Deep Learning with Group-wise Clipping
4517	Trimsformer: Trimming Transformer via Searching for Low-Rank Structure
4518	Latent Hierarchical Imitation Learning for Stochastic Environments
4519	MC-SSL: Towards Multi-Concept Self-Supervised Learning
4521	Revealing Dominant Eigendirections via Spectral Non-Robustness Analysis in the Deep Reinforcement Learning Policy Manifold
4522	Deep Probabilistic Time Series Forecasting over Long Horizons
4523	Active Learning at the ImageNet Scale
4524	Learning Debiased Representations via Conditional Attribute Interpolation
4525	Provably Efficient Neural Offline Reinforcement Learning via Perturbed Rewards
4526	Distilling Pre-trained Knowledge in Chemical Reactions for Molecular Property Prediction
4527	Temporal Disentanglement of Representations for Improved Generalisation in Reinforcement Learning
4528	Understanding The Robustness of Self-supervised Learning Through Topic Modeling
4529	GMML is All you Need
4530	Obtaining More Generalizable Fair Classifiers on Imbalanced Datasets
4531	On the Forward Invariance of Neural ODEs
4533	Highly Parallel Deep Ensemble Learning
4534	Conceptual Behavior and Human-Likeness in Vision-and-Language Models
4535	Quantization-aware Policy Distillation (QPD)
4537	REST: REtrieve & Self-Train for generative action recognition
4538	Islands of Confidence: Robust Neural Network Classification with Uncertainty Quantification
4541	ULF: UNSUPERVISED LABELING FUNCTION CORRECTION USING CROSS-VALIDATION FOR WEAK SUPERVISION
4542	Efficient neural representation in the cognitive neuroscience domain: Manifold Capacity in One-vs-rest Recognition Limit
4543	Transformers Learn Shortcuts to Automata
4545	Closed-loop Transcription via Convolutional Sparse Coding
4546	$k$NN Prompting: Learning Beyond the Context with Nearest Neighbor Inference
4547	MultiQuan RDP: Rate-Distortion-Perception Coding via Offset Quantizers
4549	Exploring Methods for Parsing Movie Scripts - Feature Extraction for Further Social Injustice Analysis
4550	Autoregressive Conditional Neural Processes
4551	Pareto Manifold Learning: Tackling multiple tasks via ensembles of single-task models
4552	Robust Scheduling with GFlowNets
4555	Graph Contrastive Learning with Model Perturbation
4556	Decentralized Optimistic Hyperpolicy Mirror Descent: Provably No-Regret Learning in Markov Games
4557	SAGE: Semantic-Aware Global Explanations for Named Entity Recognition
4558	Distributed Graph Neural Network Training with Periodic Stale Representation Synchronization
4560	Fourier PINNs: From Strong Boundary Conditions to Adaptive Fourier Bases
4561	Stein Variational Goal Generation for adaptive Exploration in Multi-Goal Reinforcement Learning
4562	Removing Structured Noise with Diffusion Models
4565	Federated Learning on Adaptively Weighted Nodes by Bilevel Optimization
4566	PAC Reinforcement Learning for Predictive State Representations
4567	Towards Multi-spatiotemporal-scale Generalized PDE Modeling
4568	$\sigma$Reparam: Stable Transformer Training with Spectral Reparametrization
4569	Improving Adversarial Robustness by Contrastive Guided Diffusion Process
4570	An ensemble view on mixup
4573	Spectral Augmentation for Self-Supervised Learning on Graphs
4574	Training Normalizing Flows from Dependent Data
4575	MACTA: A Multi-agent Reinforcement Learning Approach for Cache Timing Attacks and Detection
4576	$\mathcal{O}$-GNN: incorporating ring priors into molecular modeling
4577	Latent Neural ODEs with Sparse Bayesian Multiple Shooting
4579	Emergence of Maps in the Memories of Blind Navigation Agents
4581	Dynamic Scheduled Sampling with Imitation Loss for Neural Text Generation
4582	3D Neural Embedding Likelihood for Robust Sim-to-Real Transfer in Inverse Graphics
4583	A new photoreceptor-inspired CNN layer enables deep learning models of retina to generalize across lighting conditions
4586	FUN: Filter-based Unlearnable Datasets
4588	Learning Fair Graph Representations via Automated Data Augmentations
4590	Learning About Progress From Experts
4591	Soft Sampling for Efficient Training of Deep Neural Networks on Massive Data
4592	Understanding DDPM Latent Codes Through Optimal Transport
4593	Burstormer: Burst Image Restoration and Enhancement Transformer
4595	Interneurons accelerate learning dynamics in recurrent neural networks for statistical adaptation
4596	DCT-DiffStride: Differentiable Strides with Real-Valued Data
4597	Variational Prompt Tuning Improves Generalization of Vision-Language Models
4598	Wide Attention is the Way Forward for Transformers
4599	Neural Network Differential Equation Solvers allow unsupervised error estimation and correction
4601	CLUSTERBERT: MULTI-STAGE FINE-TUNING OF TRANSFORMERS FOR DEEP TEXT CLUSTERING
4602	FP_AINet: Fusion Prototype with Adaptive Induction Network for Few-Shot Learning
4603	Predicting Out-of-Domain Generalization with Local Manifold Smoothness
4604	Repository-Level Prompt Generation for Large Language Models of Code
4606	Learning to Unlearn: Instance-wise Unlearning for Pre-trained Classifiers
4608	COC curve: operating neural networks at high accuracy and low manual effort
4609	Bringing robotics taxonomies to continuous domains via GPLVM on hyperbolic manifolds
4610	Generating Sequences by Learning to Self-Correct
4611	Multi-Task Structural Learning using Local Task Similarity induced Neuron Creation and Removal
4612	Differentially Private Conditional Text Generation For Synthetic Data Production
4613	On the optimization and generalization of overparameterized implicit neural networks
4616	TimeSeAD: Benchmarking Deep Time-Series Anomaly Detection
4621	Disentanglement of Correlated Factors via Hausdorff Factorized Support
4622	Choreographer: Learning and Adapting Skills in Imagination
4623	TTN: A Domain-Shift Aware Batch Normalization in Test-Time Adaptation
4624	Sequential Gradient Coding For Straggler Mitigation
4625	Semantic Transformation-based Data Augmentation for Few-Shot Learning
4629	Univariate vs Multivariate Time Series Forecasting with Transformers
4630	Revisiting Populations in multi-agent Communication
4631	Certifiably Robust Transformers with 1-Lipschitz Self-Attention
4632	DIFFUSION GENERATIVE MODELS ON SO(3)
4634	Direct-Effect Risk Minimization
4635	Amortised Invariance Learning for Contrastive Self-Supervision
4636	Neural Implicit Shape Editing using Boundary Sensitivity
4638	A Subspace Correction Method for ReLU Neural Networks for Solving PDEs
4639	Improved Learning-augmented Algorithms for k-means and k-medians Clustering
4640	Fast Bayesian Updates for Deep Learning with a Use Case in Active Learning
4641	Semi-parametric Prompt-Generation for Model Editing
4643	Using semantic distance for diverse and sample efficient genetic programming
4644	Optimal Scalarizations for Provable Multiobjective Optimization
4645	Reprogramming Large Pretrained Language Models for Antibody Sequence Infilling
4646	Maximum Entropy Information Bottleneck for Confidence-aware Stochastic Embedding
4647	Canary in a Coalmine: Better Membership Inference with Ensembled Adversarial Queries
4648	Masked Siamese ConvNets: Towards an Effective Masking Strategy for General-purpose Siamese Networks 
4649	SYNC: Efficient Neural Code Search Through Structurally Guided Hard Negative Curricula
4651	Beyond Link Prediction: On Pre-Training Knowledge Graph Embeddings
4652	The Adversarial Regulation of the Temporal Difference Loss Costs More Than Expected
4653	A Scalable Finite Difference Method for Deep Reinforcement Learning
4655	ResGrad: Residual Denoising Diffusion Probabilistic Models for Text to Speech
4656	Fine-grain Inference on Out-of-Distribution Data with Hierarchical Classification
4657	TOWARDS AN OBJECTIVE EVALUATION OF THE TRUSTWORTHINESS OF CLASSIFIERS
4658	PMI-guided Masking Strategy to Enable Few-shot Learning for Genomic Applications
4661	Self-Supervised Learning of Maximum Manifold Capacity Representations
4662	Smooth Mathematical Functions from Compact Neural Networks
4664	SoftZoo: A Soft Robot Co-design Benchmark For Locomotion In Diverse Environments
4665	Hardware-aware compression with Random Operation Access Specific Tile (ROAST) hashing
4666	ImageNet-X: Understanding Model Mistakes with Factor of Variation Annotations
4667	Non-Gaussian Process Regression
4668	Shuffled Transformers for Blind Training
4669	A Cognitive-inspired Multi-Module Architecture for Continual Learning
4670	Unsupervised Model-based Pre-training for Data-efficient Control from Pixels
4671	Convexifying Transformers: Improving optimization and understanding of transformer networks
4672	AlphaFold Distillation for Improved Inverse Protein Folding
4673	DLP: Data-Driven Label-Poisoning Backdoor Attack
4675	Meta Learning to Bridge Vision and Language Models for Multimodal Few-Shot Learning
4676	Robust Exploration via Clustering-based Online Density Estimation
4677	Scaling Laws For Deep Learning Based Image Reconstruction
4678	The Robustness Limits of SoTA Vision Models to Natural Variation
4679	Bridging between Pool- and Stream-Based Active Learning with Temporal Data Coherence
4680	SkillS: Adaptive Skill Sequencing for Efficient Temporally-Extended Exploration
4681	Proposal-Contrastive Pretraining for Object Detection from Fewer Data
4682	Rethinking Uniformity in Self-Supervised Representation Learning
4684	In-Situ Text-Only Adaptation of Speech Models with Low-Overhead Speech Imputations
4685	Topological Data Analysis-Deep Learning Framework for Predicting Cancer Phenotypes
4686	CLMIU: Commonsense Learning in Multimodal Image Understanding.
4687	Why Did This Model Forecast This Future? Information-Theoretic Temporal Saliency for Counterfactual Explanations of Probabilistic Forecasts
4688	Off Policy Average Reward Actor Critic with Deterministic Policy Search
4689	Fusion over the Grassmann Manifold for Incomplete-Data Clustering
4690	On the Expressive Power of Geometric Graph Neural Networks
4691	Improving Generalization of Motor-Imagery Brainwave Decoding via Dynamic Convolutions
4692	Aligning Model and Macaque Inferior Temporal Cortex Representations Improves Model-to-Human Behavioral Alignment and Adversarial Robustness
4694	Time Series Subsequence Anomaly Detection via Graph Neural Networks
4695	Spurious Features in Continual Learning
4696	Triplet learning of task representations in latent space for continual learning
4698	Multi-instance Interactive Segmentation with Self-Supervised Transformer
4699	Towards Antisymmetric Neural Ansatz Separation
4701	Re-Benchmarking Out-of-Distribution Detection in Deep Neural Networks
4703	$\ell$Gym: Natural Language Visual Reasoning with Reinforcement Learning
4704	A Scalable Training Strategy for Blind Multi-Distribution Noise Removal
4706	Single SMPC Invocation DPHelmet: Differentially Private Distributed Learning on a Large Scale
4707	Metadata Archaeology: Unearthing Data Subsets by Leveraging Training Dynamics
4708	Do We Really Need Labels for Backdoor Defense?
4710	MyoDex: Generalizable Representations for Dexterous Physiological Manipulation
4711	Tiered Pruning for Efficient Differentialble Inference-Aware Neural Architecture Search
4712	Meta-Learning via Classifier(-free) Guidance
4713	Mask-tuning: Towards  Improving  Pre-trained Language Models' Generalization
4714	Density Sketches for Sampling and Estimation
4715	Applying Second Order Optimization to Deep Transformers with Parameter-Efficient Tuning
4716	A probabilistic framework for task-aligned intra- and inter-area neural manifold estimation
4718	Forget to Learn (F2L): Rethinking Replay Loss in Unsupervised Continuous Domain Adaptation
4719	MMVAE+: Enhancing the Generative Quality of Multimodal VAEs without Compromises
4721	Heterogeneous Neuronal and Synaptic Dynamics for Spike-Efficient Unsupervised Learning: Theory and Design Principles
4722	Distinguishing Feature Model for Ranking From Pairwise Comparisons
4723	Efficient Conditionally Invariant Representation Learning
4725	PES: Probabilistic Exponential Smoothing for Time Series Forecasting
4729	Image Emotion Recognition using Cognitive Contextual Summarization Framework
4730	Gaussian-Bernoulli RBMs Without Tears
4731	URVoice: An Akl-Toussaint/ Graham- Sklansky Approach towards Convex Hull Computation for Sign Language Interpretation
4733	(Certified!!) Adversarial Robustness for Free!
4736	Improved Group Robustness via Classifier Retraining on Independent Splits
4737	HiT-MDP: Learning the SMDP option framework on MDPs with Hidden Temporal Variables
4738	ResFed: Communication Efficient Federated Learning by Transmitting Deep Compressed Residuals
4739	Efficient Exploration using Model-Based Quality-Diversity with Gradients
4740	 Debiasing the Pre-trained Language Model  Through Fine-tuning the Downstream Tasks
4742	Is end-to-end learning enough for fitness activity recognition?
4744	Data dependent frequency sensitivity of convolutional neural networks
4745	Large language models are not zero-shot communicators
4746	Making Better Decision by Directly Planning in Continuous Control
4749	Multi-Objective GFlowNets
4750	SP2 : A Second Order Stochastic Polyak Method
